a00_cle_idweb,g04_01_date_publication,g04_03_date_fin_diffusion,g04_07_dep_publication,g04_09_resume_objet,g01_02_01_famille,g01_02_02_perimetre,g01_02_03_nature,g01_02_04_statut,d01_01_denomination,d01_07_cp,d01_08_ville,d08_09_decision_titulaireandRENSEIGNEMENT,g04_052_descripteurs_libelles,g04_051_descripteurs_codes,g04_061_criteres_sociaux,g04_062_criteres_environnementaux
19-190690,2019-12-22,2020-01-23,['74'],Marché de contrôle technique pour la réhabilitation et extension du groupe scolaire Saint-Exupéry à Publier (74),mapa,cmp2006,appeloffre,initial,COMMUNE DE PUBLIER,74500,Publier,,['Contrôle technique'],[72],non,non
19-190107,2019-12-22,2020-03-18,['74'],Assurance des risques statutaires du personnel,joue,directive24,attribution,initial,Commune de Viry,74580,Viry,"[('2019-11-26', 'Sofaxis', (203286, 'EUR'), None)]",['Assurance'],[20],non,non
19-190259,2019-12-22,2020-03-18,['74'],Confection et livraison de repas en liaison froide pour le restaurant scolaire,joue,directive24,attribution,initial,Commune de Viry,74580,Viry,"[('2019-11-26', 'Leztroy', (774520, 'EUR'), None)]",['Restauration collective'],[66],non,non
19-190028,2019-12-22,2020-01-28,['74'],Marché d'études de faisabilité portant sur la réhabilitation d'installations d'assainissement non collectif,joue,directive24,appeloffre,initial,SYNDICAT MIXTE DU LAC D ANNECY,74960,Cran-Gevrier,,['Assainissement'],[18],non,non
19-189884,2019-12-22,2020-01-22,['75'],Prestations photographiques,joue,directive24,appeloffre,initial,Agence nationale de l'habitat,75001,Paris,,"['Publicité, Communication']",[285],non,non
19-189903,2019-12-22,2020-02-07,['75'],Maintenance des fermetures,joue,directive24,appeloffre,initial,Musée du Louvre,75001,Paris,,['Prestations de services'],[274],oui,non
19-190524,2019-12-22,2020-03-01,['75'],Diagnostics et études de réseaux de fluides et d'installations énergétiques,joue,directive24,appeloffre,initial,Etablt Public du Campus de Jussieu,75002,Paris,,['Etude'],[118],non,non
19-189826,2019-12-22,2020-01-22,['75'],Fourniture d'une source laser régénérative femtoseconde pour la microscopie biphotonique et triphonique pour l'ENS,joue,directive24,appeloffre,initial,ECOLE NORMALE SUPERIEURE,75005,Paris,,"['Equipements spécialisés', 'Laboratoire (matériel)']","[115, 188]",non,non
19-189984,2019-12-22,2020-02-05,['75'],DISPOSITIFS MEDICAUX DE PERFUSION et D'ADMINISTRATION DE CHIMIOTHERAPIES ET PRODUITS ASSOCIES,joue,directive24,appeloffre,initial,ASSISTANCE PUBLIQUE HOPITAUX DE PARIS,75005,Paris,,"['Matériel médical', 'Produits pharmaceutiques']","[212, 280]",non,non
19-189889,2019-12-22,2020-01-22,['75'],Fourniture d'une source laser régénérative femtoseconde pour la microscopie biphotonique et triphonique pour l'ENS,joue,directive24,appeloffre,initial,ECOLE NORMALE SUPERIEURE,75005,Paris,,"['Equipements spécialisés', 'Laboratoire (matériel)']","[115, 188]",non,non
19-189947,2019-12-22,2020-01-20,['75'],Réalisation du magazine du groupe Caisse des Dépôts,joue,directive24,appeloffre,initial,CAISSE DES DEPOTS,75007,Paris,,['Prestations de services'],[274],non,non
19-189915,2019-12-22,2020-01-28,['75'],Travaux de réfection de l'étanchéité du site Duquesne,joue,autre,rectificatif,rectificatif,"Ministères santé, travail et sport",75007,Paris,,['Bâtiment'],[33],oui,oui
19-189791,2019-12-22,2020-02-10,['75'],Marché d'accompagnement et d'audit pour la labellisation Famille Plus sur le territoire des stations de montagne membres de l'Association Nationale des Maires des Stations de Monta,joue,directive24,appeloffre,initial,ANMSM,75008,Paris,,['Audit'],[21],non,non
19-190640,2019-12-22,2020-01-27,['75'],"Réalisation de cloisons, faux plafonds, faux planchers et pose de stores",joue,directive24,appeloffre,initial,EPPDCSI,75008,Paris,,"['Cloison, faux plafond']",[63],non,non
19-189967,2019-12-22,2020-03-18,['75'],"Fourniture, l'intégration et la maintenance d'équipements réseau Reverse proxy, en remplacement de deux équipements Bluecoat",joue,directive24,attribution,initial,EPPDCSI,75008,Paris,"[('2019-12-19', 'Certilience', (43983, 'EUR'), None)]","['Informatique (prestations de services)', 'Informatique (maintenance serveurs et réseaux)']","[163, 454]",non,non
19-190649,2019-12-22,2020-01-20,['75'],"Prestations d'accessoiristes, socleurs pour l'exposition Jeans",joue,directive24,appeloffre,initial,EPPDCSI,75008,Paris,,['Equipements spécialisés'],[115],non,non
19-190639,2019-12-22,2020-01-27,['75'],Accord cadre de maîtrise d'oeuvre pour les travaux de traitement des matériaux et produits contenant de l'amiante à la Cité des Sciences et de l'Industrie et au Palais de la Découve,joue,directive24,appeloffre,initial,EPPDCSI,75008,Paris,,['Amiante (diagnostic)'],[431],non,non
19-190432,2019-12-22,2020-01-30,['75'],"Accord cadre de travaux de VRD, petits travaux de génie civil et d'intervention d'entretien sur des aménagements et ouvrages existants",joue,directive24,attribution,initial,SOC DE LIVRAISON OUVRAGES OLYMPIQUES,75009,Paris,,"[""Ouvrage d'art"", ""Ouvrage d'infrastructure"", 'Réseaux divers']","[252, 253, 306]",non,non
19-190313,2019-12-22,2020-01-31,['75'],Prestations de communication institutionnelle pour les besoins de la SOLIDEO (4 lots),joue,directive24,attribution,initial,SOC DE LIVRAISON OUVRAGES OLYMPIQUES,75009,Paris,,"['Publicité, Communication']",[285],non,non
19-189530,2019-12-22,2020-04-17,['75'],ZAC Village Olympique et Paralympique- Travaux de viabilisation phase 1 LOT 3,joue,directive24,appeloffre,initial,SOC DE LIVRAISON OUVRAGES OLYMPIQUES,75009,Paris,,"['Travaux de viabilité', 'Voirie']","[353, 365]",non,non
19-190525,2019-12-22,2020-02-29,['75'],Marché global de performance pour la construction d'un groupe scolaire à Saint-Ouen-sur-Seine (93) - ZAC du Village Olympique et Paralympique,joue,directive24,appeloffre,initial,SOC DE LIVRAISON OUVRAGES OLYMPIQUES,75009,Paris,,['Bâtiment'],[33],non,non
19-189837,2019-12-22,2020-02-18,['75'],Prestations de service d'assurance de flotte automobile,joue,directive24,appeloffre,initial,GIP RESAH,75011,Paris,,"['Assurance', 'Prestations de services']","[20, 274]",non,non
19-190652,2019-12-22,2023-12-31,['75'],Fourniture de dispositifs médicaux stériles (DMS). SAD 2020-023,joue,directive24,appeloffre,initial,GIP RESAH,75011,PARIS,,"['Matériel médical', 'Produits pharmaceutiques']","[212, 280]",non,oui
19-189715,2019-12-22,2020-02-01,['75'],"Acquisition, location ou mise à disposition d'automates de biologie moléculaire et prestations associées",joue,autre,rectificatif,rectificatif,GIP RESAH,75011,Paris,,['Matériel médical'],[212],non,non
19-190471,2019-12-22,2020-02-03,['75'],MISE A DISPOSITION D'UNE PLATEFORME CLOUD PROPOSANT DES MODULES D'INTELLIGENCE ARTIFICIELLE D'AIDE AU DIAGNOSTIC ET DE POST-TRAITEMENT CLINIQUE POUR L'IMAGERIE MEDICALE,joue,directive24,appeloffre,initial,GIP RESAH,75011,Paris,,['Logiciel'],[186],non,non
19-189855,2019-12-22,2020-01-31,['75'],"Prestations d'audits internes sur les directions du SIAAP Lot no01 - Audits accompagnés, audits blancs, et audits spécifiquesLot no02 - Audits sous accréditation COFRAC",joue,directive24,appeloffre,initial,SIAAP,75012,Paris,,['Audit'],[21],non,non
19-190240,2019-12-22,2020-01-30,['75'],Travaux de démantèlement de 2 îlots de survie piscicoles situés à Rueil-Malmaison et Issy-les-Moulineaux,joue,directive24,appeloffre,initial,SIAAP,75012,Paris,,"['Démolition', 'Equipements spécialisés']","[87, 115]",non,non
19-190345,2019-12-22,2020-02-28,['75'],Fourniture et livraison de pain frais et de viennoiseries issus de l'agriculture biologique pour les cuisines de la Caisse des Écoles du 12ème arrondissement de Paris,joue,directive24,attribution,initial,Caisse des Ecoles du 12ème,75012,Paris,"[('2019-12-13', 'SAS ECOPAIN', (674000, 'EUR'), ""Fourniture et livraison de pain frais et de viennoiseries issus de l'agriculture biologique pour les cuisines de la Caisse des Écoles du 12ème arrondissement de Paris"")]",['Denrées alimentaires'],[88],non,non
19-190377,2019-12-22,2020-02-28,['75'],"Fourniture et acheminement d'électricité, ainsi que la réalisation de services associés, pour les points de livraison de la Caisse des écoles du 12e",joue,directive24,attribution,initial,Caisse des Ecoles du 12ème,75012,Paris,,"['Electricité, gaz (fourniture)']",[443],non,non
19-190382,2019-12-22,2020-01-16,"['75', '92']",Travaux de mise en oeuvre d'une installation de gestion des sables mécanisée dans l'usine de prétraitement d'Alfortville.,joue,autre,rectificatif,rectificatif,SIAAP,75012,Paris,,['Assainissement'],[18],non,non
19-190063,2019-12-22,2020-01-24,['75'],"LAS 2 : Travaux de réhabilitation des équipements. (noeud d'interconnexion entre la liaison Auteuil -Saint Cloud (LAS), ouvrage du SIAAP et le collecteur rive droite de Seine (RDS), ouvrage du CD",joue,directive24,appeloffre,initial,SIAAP,75012,Paris,,['Assainissement'],[18],non,non
19-187601,2019-12-22,2020-02-25,['75'],logiciel de suivi des opérations immobilières de l'oppic-avis attribution,joue,directive24,attribution,initial,OPPIC,75013,Paris,"[('2019-12-20', 'Gesprojet by pro-logiq', (291500, 'EUR'), None)]","['Informatique (prestations de services)', 'Logiciel', 'Maintenance', 'Prestations de services', 'Progiciel', 'Formation', 'Informatique (assistance)', 'Informatique (maintenance serveurs et réseaux)']","[163, 186, 196, 274, 283, 410, 453, 454]",non,non
19-190549,2019-12-22,2020-01-20,['75'],Mission de bureau de contrôle technique dans le cadre des travaux initiaux du MPGPE pour 60 écoles parisiennes,joue,directive24,appeloffre,initial,VILLE DE PARIS,75013,Paris,,['Contrôle technique'],[72],non,non
19-190162,2019-12-22,2020-02-05,"['76', '27', '78', '95', '77', '91']",Mise en place d'un suivi du flux de poissons relatif à l'expérimentation des éclusées à poissons sur l'écluse de Poses,joue,directive24,appeloffre,initial,Voies navigables de France,75013,Paris,,['Prestations de services'],[274],non,non
19-190553,2019-12-22,2020-01-19,['75'],Mission d'assistance à la livraison de programmes immobiliers,joue,directive24,appeloffre,initial,ASSOCIATION FONCIERE DE LOGEMENT,75013,Paris,,['Assistance technique'],[19],non,non
19-190591,2019-12-22,2020-02-22,['75'],Maintenance radiologie : salle télécommandée et panoramique,joue,directive24,appeloffre,initial,CENTRE HOSPITALIER SAINTE ANNE PARIS,75014,Paris,,['Prestations de services'],[274],non,non
19-190588,2019-12-22,2020-04-30,['75'],Prestation de transport des usagers de l'accueil de jour de la MAS,joue,directive24,appeloffre,initial,CENTRE HOSPITALIER SAINTE ANNE PARIS,75014,Paris,,"['Prestations de services', 'Transport']","[274, 347]",non,oui
19-189582,2019-12-22,2020-02-15,['75'],Réalisation des missions du gestionnaire territorial du système national d'enregistrement de la demande de logement social,joue,directive24,attribution,initial,GIP SNE,75014,Paris,"[('2019-12-19', 'Aatiko Conseils', (635000, 'EUR'), ""Réalisation des missions du gestionnaire territorial du système national d'enregistrement de la demande de logement social"")]",['Prestations de services'],[274],non,non
19-190552,2019-12-22,2020-02-07,"['75', '91', '92', '93', '94', '95', '78', '77', '60']",Sté d'Exploitation de la Tour Eiffel,joue,directive24,appeloffre,initial,Sté d'Exploitation de la Tour Eiffel,75015,Paris,,['Prestations de services'],[274],non,non
19-190592,2019-12-22,2020-02-03,['75'],Prestations de service d'archivage,joue,directive24,appeloffre,initial,ASIP Santé,75015,Paris,,"['Informatique (prestations de services)', 'Prestations de services']","[163, 274]",non,non
19-190035,2019-12-22,2020-01-31,['75'],Prestations d'études de fréquences dans le cadre de la diffusion des services de radio,joue,directive24,appeloffre,initial,Conseil supérieur de l'audiovisuel,75015,Paris,,['Etude'],[118],non,non
19-190563,2019-12-22,2020-02-01,['75'],"MARCHE MULTITECHNIQUES DE CONDUITE, D'EXPLOITATION ET DE MAINTENANCE SUR LE BATIMENT DE L'INSTITUT IMAGINE",joue,directive24,appeloffre,initial,IMAGINE INST MALADIES GENETIQUES NECKE,75015,Paris,,"['Maintenance', 'Prestations de services']","[196, 274]",non,oui
19-190198,2019-12-22,2020-01-27,['75'],La fourniture d'appareils de vidéo projection à technologie Laser et d'appareils projecteurs de découpe à technologie LED,joue,directive24,appeloffre,initial,EPPGHV,75019,Paris,,"['Audiovisuel', 'Matériel électrique', 'Matériel scénique']","[22, 203, 216]",non,non
19-190357,2019-12-22,2020-01-27,['75'],Création d'un escalier et compartimentage - REGION SULLY SUD - LOT 07,joue,directive24,appeloffre,initial,Musée du Louvre,75058,Paris cedex 01,,"['Bâtiment', 'Sécurité incendie']","[33, 332]",non,non
19-190593,2019-12-22,2020-02-15,['75'],Travaux de consolidation définitive de la charpente et des planchers et aménagement des locaux de travail de l'aile Rohan - Lots no 01 à 08,joue,directive24,appeloffre,initial,Musée du Louvre,75058,Paris cedex 01,,"[""Tous corps d'état""]",[345],oui,oui
19-189982,2019-12-22,2020-03-02,['75'],"Mise à disposition et maintenance d'une plateforme de dématérialisation de copies d'examens, numérisation de copies d'examens pour l'EPN10 du Cnam",joue,directive24,appeloffre,initial,CNAM,75141,Paris cedex 03,,['Numérisation'],[463],non,non
19-190461,2019-12-22,2020-01-24,"['75', '78', '93']","Entretien et conduite des installations de chauffage, de ventilation, de climatisation et de plomberie pour les sites franciliens du Cnam",joue,directive24,appeloffre,initial,CNAM,75141,Paris cedex 03,,"['Chauffage (exploitation, entretien)']",[59],non,non
19-189720,2019-12-22,2020-12-20,['75'],Emission et gestion de titres de paiement préfinancés en faveur des agents de la Préfecture de police,joue,autre,rectificatif,rectificatif,Préfecture de Police,75195,Paris Cedex 04,,['Prestations de services'],[274],non,non
19-190146,2019-12-22,2021-01-31,['75'],"Accord cadre relatif à l'édition, la diffusion et la promotion d'ouvrages spécialisés en industries culturelles",joue,directive24,appeloffre,initial,Université Panthéon-Assas Paris II,75231,Paris cedex 05,,"['Abris', 'Edition']","[1, 104]",non,oui
19-189764,2019-12-22,2020-04-20,"['75', '91', '92', '93', '94', '95', '77', '78']","Fourniture, impression, livraison sur le littoral d'enveloppes prêtes à poster pour la collecte et la transmission des déclarations des pêcheurs professsionnels",joue,directive24,appeloffre,initial,Ministère de l'agriculture,75349,Paris 07 sp,,['Colis'],[65],non,oui
19-190565,2019-12-22,2020-01-31,['75'],Achat de prestations de contrôle de service fait d'opérations subventionnées par le Fonds social européen en gestion directe de la mission des projets nationaux,joue,directive24,attribution,initial,Ministère du travail et de l'emploi,75350,Paris sp,"[('2019-12-04', 'Titulaire no1 : FAR CONSEIL', (139950, 'EUR'), 'Contrôles de service fait de catégories 1 et 2'), ('2019-12-04', 'Titulaire no2: Deloitte Expertises Européennes', (88530, 'EUR'), 'Contrôles de service fait de catégories 1 et 2'), ('2019-12-04', 'Titulaire no1 : FAR CONSEIL', (139500, 'EUR'), 'Contrôles de service fait de catégories 3 et 4'), ('2019-12-04', 'Titualire no2: Deloitte Expertises Européennes', (99000, 'EUR'), 'Contrôles de service fait de catégories 3 et 4')]",['Audit'],[21],non,non
19-186862,2019-12-22,2020-02-18,['75'],Maintien en condition opérationnelle d'équipements aéroportés et de moyens sols associés.,joue,directive81,attribution,initial,MINARM/DMAé,75509,Paris cedex 15,"[('2019-11-26', 'MBDA France', (157502005.9, 'EUR'), None)]",['Aéronautique'],[4],non,non
19-188315,2019-12-22,2020-02-20,['75'],Maintien en condition opérationnelle des contrôles locaux d'aérodromes (cla) des bases de l'aéronautique navale (ban),joue,directive81,attribution,initial,MINARM/DMAé,75509,Paris cedex 15,"[('2019-12-16', 'Groupement conjoint CS-SI et AIRBUS DS', (7554224, 'EUR'), None)]",['Aéronautique'],[4],non,non
19-190394,2019-12-22,2019-12-31,['75'],Tierce maintenance applicative de l'application GRID,joue,directive24,attribution,initial,MINDEF/SGA/SPAC/S-Direction des achats,75509,Paris cedex 15,"[('2019-11-19', 'ACTIMAGE CONSULTING SAS', (569016, 'EUR'), ""Tierce maintenance applicative de l'application GRID"")]",['Informatique (prestations de services)'],[163],non,non
19-190123,2019-12-22,2020-01-23,['75'],Fourniture d'une veille médiatique au profit du ministère des armées,joue,directive24,appeloffre,initial,ministère de la défense,75509,Paris cedex 15,,['Prestations de services'],[274],non,non
19-190464,2019-12-22,2020-01-31,['92'],Assistance à maîtrise d'ouvrage pour la procédure de reprise des concessions échues ou abandonnées,joue,directive24,appeloffre,initial,SIFUREP,75588,Paris cedex 12,,"['Cercueils', 'Prestations de services']","[55, 274]",non,non
19-190279,2019-12-22,2020-02-20,"['75', '92']","Marché de prestations intellectuelles d'études pour la transformation du tunnel routier de l'Etoile et des accès à l'Arc de Triomphe, place Charles de Gaulle (8ème, 16ème, 17ème).",joue,directive24,appeloffre,initial,Ville de Paris,75639,Paris cedex 13,,['Etude'],[118],non,non
19-187019,2019-12-22,2020-01-24,['75'],richelieu phase 2 - aménagement du musée de la bnf - lot 1 mobilier scénographique et graphisme,joue,directive24,appeloffre,initial,OPPIC,75647,PARIS CEDEX 13,,"['Climatisation', 'Mobilier', 'Serrurerie', 'Vitrerie', 'Occultation']","[62, 230, 321, 363, 414]",non,non
19-188309,2019-12-22,2020-02-20,['75'],services de veille et d'analyse médias pour l'inserm,joue,directive24,attribution,initial,Inserm - Administration du Siège,75654,Paris,,"['Publicité, Communication']",[285],non,non
19-190354,2019-12-22,2020-02-15,['75'],Travaux de nettoyage des locaux du siège,joue,directive24,appeloffre,initial,C.G.O.S,75654,Paris cedex 13,,['Nettoyage de locaux'],[239],non,non
19-190210,2019-12-22,2020-01-30,['75'],"Formations à la prévention des risques de radicalisation, violence et harcèlement en ligne",joue,directive24,appeloffre,initial,CNAF,75685,Paris,,['Prestations de services'],[274],non,non
19-190137,2019-12-22,2020-01-27,"['75', '93', '92', '95', '78', '91', '94', '77']","CCAEM d'un bâtiment tertiaire et technique, d'un bâtiment d'accueil et d'un poste de livraison électrique à Romainville (93)",joue,autre,rectificatif,rectificatif,Ministère de la défense - BCAC-CG195/M,75700,Paris sp 07,,['Bâtiment'],[33],non,non
19-190512,2019-12-22,2020-02-03,['75'],Réalisation de prestations de développements agiles et de tierce maintenance applicative du portefeuille SI-Formations,joue,directive24,appeloffre,initial,Ministère de l'éducation nationale,75732,Paris cedex 15,,['Logiciel'],[186],oui,non
19-189156,2019-12-22,2020-02-21,"['75', '78']",Travaux de construction du pôle sportif Pierre Mazeaud à Saint-Cyr l'Ecole (78),joue,directive24,attribution,initial,Grand Paris Aménagement,75945,Paris cedex19,,"['Ascenseur', 'Bardage', 'Bâtiment', 'Charpente', 'Cloison, faux plafond', 'Couverture', 'Electricité (travaux)', 'Equipement sportif', 'Menuiserie', 'Peinture (travaux)', 'Plomberie (travaux)', 'Réseaux divers', 'Revêtements de sols', 'Serrurerie', 'Terrassement']","[17, 30, 33, 57, 63, 74, 105, 113, 222, 264, 270, 306, 308, 321, 341]",non,non
19-189575,2019-12-22,2020-01-27,['75'],Acquisition de dispositifs et accessoires d'implantologie orale des centres de santé dentaire de la CPAM de Paris,joue,directive24,appeloffre,initial,CAISSE PRIMAIRE ASSUR MALADIE PARIS,75948,Paris cedex 19,,"['Implants', 'Matériel médical']","[159, 212]",non,oui
19-189781,2019-12-22,2020-02-28,['75'],Renouvellement du réseau capillaire de l'Assurance Maladie,joue,directive24,appeloffre,initial,CNAMTS,75986,Paris cedex 20,,['Informatique (prestations de services)'],[163],non,non
19-190528,2019-12-22,2020-01-02,['75'],MARCHE DE CONCEPTION ET D'EXPLOITATION DE QUESTIONNAIRES DIGITAUX RELATIFS AUX SAVOIR-ETRE PROFESSIONNELS,joue,directive24,attribution,initial,POLE EMPLOI,75987,Paris Cedex 20,"[('2019-12-19', 'SAS ASSESSFIRST', (380000, 'EUR'), 'Elaboration et mise à disposition de trois questionnaires digitaux en hébergement SaaS pour l\'évaluation des demandeurs d\'emploi bénéficiant de la prestation ""Valoriser son Image Professionnelle "".')]",['Informatique (prestations de services)'],[163],non,non
19-189890,2019-12-22,2020-01-24,"['76', '14', '27', '80']","Prestations de pompage, vidange et nettoyage par camions",joue,directive25,appeloffre,initial,GRAND PORT MARITIME DE ROUEN,76022,Rouen cedex,,['Prestations de services'],[274],non,non
19-190219,2019-12-22,2020-01-21,['76'],"Fourniture, livraison et installation de mobilier de bureau pour le nouveau siège d'Habitat 76",joue,directive24,appeloffre,initial,HABITAT 76,76040,Rouen,,['Mobilier'],[230],non,non
19-190498,2019-12-22,2020-01-16,['76'],Mission D'Assistance A Maitrise D'Ouvrage Et De Conseil Sur Le Volet Environnemental Du Projet De Pole Croisiere De La Pointe De Floride,joue,autre,rectificatif,rectificatif,CU AGL HAVRAISE CANT CRIQUETOT ESNEVAL,76085,Le Havre,,"[""Assistance à maîtrise d'ouvrage""]",[433],non,non
19-189663,2019-12-22,2020-01-31,['76'],Entretien et maintenance des bâtiments communautaires de la Communauté de Communes de la Côte d'Albâtre,joue,directive24,appeloffre,initial,Cté de Cnes de la Côte d'Albatre,76450,Cany barville,,"['Couverture', 'Electricité (travaux)', 'Gros oeuvre', 'Maintenance', 'Menuiserie', 'Métallerie', 'Peinture (travaux)', 'Plomberie (travaux)']","[74, 105, 144, 196, 222, 223, 264, 270]",non,non
19-189520,2019-12-22,2020-01-29,"['14', '76']","achat, livraison, montage et installation de mobiliers destinés à l'aménagement du nouveau site quai frissard le havre de l'ecole de management de normandie",joue,directive24,appeloffre,initial,ECOLE DE MANAGEMENT DE NORMANDIE,76600,LE HAVRE,,['Mobilier'],[230],non,oui
19-190275,2019-12-22,2020-04-07,['77'],Liaison Meaux-Roissy - Barreau RN2xRN3 -BLOC EST_ MOE,joue,directive24,appeloffre,initial,Conseil général de Seine-et-Marne,77010,Melun cedex,,"[""Maîtrise d'oeuvre""]",[197],non,non
19-189621,2019-12-22,2020-02-20,['77'],transport et traitement des déchets non dangereux provenant du réseau de déchèteries du smitom,joue,directive24,attribution,initial,SMITOM du Nord Seine et Marne,77122,Monthyon,"[('2019-11-12', 'Société AUBINE SASU', (6000000, 'EUR'), None)]","['Transport', 'Déchets non ménagers (prestations)']","[347, 404]",non,non
19-190405,2019-12-22,2020-01-23,['77'],Service de maintenance du parc de conteneurs,joue,directive24,appeloffre,initial,SMICTOM de la Région de Fontainebleau,77250,MORET LOING ET ORVANNE,,['Prestations de services'],[274],non,non
19-174680,2019-12-22,2020-02-24,['77'],Vêtements professionnels et équipements de protection individuelle et prestations annexes,joue,directive24,appeloffre,initial,Union des Groupements d'Achats Publics,77444,Marne-la-vallée cedex 2,,"['Chaussures ou articles chaussants', 'Habillement']","[79, 150]",oui,oui
19-190366,2019-12-22,2020-02-04,['77'],Tableaux scolaires et d'enseignement avec exécution de prestations annexes,joue,directive24,attribution,initial,Union des Groupements d'Achats Publics,77444,Marne-la-vallée cedex 2,"[('2019-11-28', 'ULMANN SAS', (890171, 'EUR'), ""Tableaux scolaires et d'enseignement spécifiques""), ('2019-11-28', 'VANERUM SAS', (6308993, 'EUR'), ""Tableaux scolaires et d'enseignement standards"")]","['Abris', 'Articles de bureau et articles scolaires']","[1, 16]",oui,oui
19-177387,2019-12-22,2020-01-27,['77'],"mise à disposition de solutions de multidiffusion et achat d'annonces ""emploi"" et prestations associées",joue,directive24,appeloffre,initial,Union des Groupements d'Achats Publics,77444,Marne-la-vallée cedex 2,,"['Informatique (prestations de services)', 'Publicité, Communication']","[163, 285]",non,non
19-189727,2019-12-22,2020-01-25,['77'],Acquisition d'une imprimante 3d d'objets métalliques,joue,directive24,attribution,initial,Ecole Nationale des Ponts et Chaussées,77455,Champs-sur-Marne,"[('2019-12-11', 'iMakr', (139800, 'EUR'), ""Acquisition d'une imprimante 3D d'objets métalliques"")]",['Machines-outils'],[194],non,non
19-190362,2019-12-22,2020-01-23,['77'],Mission de maîtrise d'oeuvre pour la construction du Gymnase de Coupvray,joue,directive24,appeloffre,initial,CA VAL D EUROPE AGGLOMERATION,77701,Marne la vallée cedex 4,,"[""Maîtrise d'oeuvre""]",[197],non,non
19-189959,2019-12-22,2020-01-21,['78'],"Fourniture, livraison et montage (si nécessaire) de jeux et jouets pour les divers services des villes de Versailles, Buc, Viroflay et Bois d'Arcy",joue,directive24,appeloffre,initial,Ville de Versailles,78000,Versailles,,"['Jeux, jouets']",[175],non,non
19-190638,2019-12-22,2020-02-11,"['78', '75']","Maintenance et gros entretien de l'éclairage public, de la signalisation lumineuse tricolore, des équipements électriques de voirie et du réseau haut",joue,directive24,appeloffre,initial,Ville de Versailles,78000,Versailles,,['Signalisation'],[322],non,non
19-189929,2019-12-22,2020-01-20,['78'],Maintenance multitechnique et prestations de services,joue,directive24,attribution,initial,CAF St-Quentin Yvelines,78011,Versailles cedex,"[('2019-12-02', 'ENGIE ES - ENGIE COFELY', (1262386, 'EUR'), ""Maintenance multitechnique et la réalisation de travaux d'aménagement""), ('2019-12-02', 'ENGIE ES - ENGIE COFELY', (1594195, 'EUR'), 'Prestations de service')]","['Maintenance', 'Prestations de services']","[196, 274]",non,non
