,a00_cle_idweb,g04_01_date_publication,g04_03_date_fin_diffusion,g04_07_dep_publication,g04_09_resume_objet,g01_02_01_famille,g01_02_02_perimetre,g01_02_03_nature,g01_02_04_statut,d01_01_denomination,d01_07_cp,d01_08_ville,d08_09_decision_titulaireandRENSEIGNEMENT,g04_052_descripteurs_libelles,g04_051_descripteurs_codes,g04_061_criteres_sociaux,g04_062_criteres_environnementaux
0,20-69517,2020-05-30,2020-07-23,['4'],Acquisition De Matériels électriques D'éclairage Public,joue,directive24,appeloffre,initial,DURANCE LUBERON VERDON AGGLOMERATION,04100,Manosque,,['Matériel électrique'],[203],non,non
1,20-69366,2020-05-30,2020-08-25,['5'],Un accord-cadre multi attributaire pour la réalisation de travaux de réparation des Oa et de travaux géotechniques,joue,directive24,attribution,initial,DEPARTEMENT DES HAUTES-ALPES,05008,Gap,"[('2020-05-26', 'Charles Queyras Tp', (1293448, 'EUR'), 'Antennes Techniques de Briançon et Eygliers'), ('2020-05-26', 'Eiffage Genie Civil', (1702740, 'EUR'), 'Antennes Techniques de Briançon et Eygliers'), ('2020-05-26', 'Festa Sas', (1395087, 'EUR'), 'Antennes Techniques de Briançon et Eygliers'), ('2020-05-26', 'Charles Queyras Tp', (1422793, 'EUR'), 'Antennes Techniques de Gap et Saint Bonnet'), ('2020-05-26', 'Festa Sas', (1358417, 'EUR'), 'Antennes Techniques de Gap et Saint Bonnet'), ('2020-05-26', 'Stp Pistono Denis', (853321, 'EUR'), 'Antennes Techniques de Gap et Saint Bonnet'), ('2020-05-26', 'Festa Sas', (1386797, 'EUR'), 'Antennes Techniques de Laragne et Veynes'), ('2020-05-26', 'Stp Pistono Denis', (853321, 'EUR'), 'Antennes Techniques de Laragne et Veynes'), ('2020-05-26', 'Gtm Sud', (736955, 'EUR'), 'Antennes Techniques de Laragne et Veynes'), ('2020-05-26', 'Freyssinet', (988775, 'EUR'), 'Travaux géotechniques'), ('2020-05-26', 'Stabilisation Protection', (978985, 'EUR'), 'Travaux géotechniques'), ('2020-05-26', 'Gtm Sud', (592300, 'EUR'), 'Travaux géotechniques')]","[""Ouvrage d'art""]",[252],non,non
2,20-69325,2020-05-30,2020-08-25,['5'],Acquisition de licences logicielles et services associés,joue,directive24,attribution,initial,DEPARTEMENT DES HAUTES-ALPES,05008,Gap,"[('2020-05-26', 'Bechtle Comsoft', (256261, 'EUR'), None)]",['Logiciel'],[186],non,non
3,20-67678,2020-05-30,2020-07-28,['6'],etudes d'incidence des loisirs et des activités de pleine nature sur l'environnement,joue,directive24,attribution,initial,Département des Alpes-Maritimes,06201,Nice cedex 3,"[('2020-04-28', 'BIOTOPE', (600000, 'EUR'), ""Etudes d'incidence des loisirs et des activités de pleine nature sur l'environnement"")]",['Etude'],[118],non,non
4,20-69266,2020-05-30,2020-06-29,['12'],Routes Départementales - Assistance technique et Contrôle externe pour les études d'infrastructures routières,joue,directive24,appeloffre,initial,Conseil Départemental de l AVEYRON,12450,FLAVIN,,['Etude'],[118],non,non
5,20-69532,2020-05-30,2020-06-29,['12'],Fourniture et transport de béton prêt à l'emploi - 10 lots,joue,directive24,appeloffre,initial,Conseil Départemental de l AVEYRON,12450,Flavin,,['Matériaux routiers'],[199],non,non
6,20-69340,2020-05-30,2020-06-06,['13'],Accord-cadre de services de nettoyage des tunnels exploités par la Métropole Aix-Marseille-Provence,joue,autre,rectificatif,rectificatif,METROPOLE D AIX MARSEILLE PROVENCE,13007,Marseille,,['Prestations de services'],[274],non,non
7,20-69176,2020-05-30,2020-07-28,"['13', '6']",maîtrise d'oeuvre (hors loi mop) pour des travaux de grosses réparations dans la région paca,joue,directive24,attribution,initial,ETS PUB FONCIER P A C A,13207,Marseille,,"[""Maîtrise d'oeuvre"", 'Prestations de services']","[197, 274]",non,non
8,20-69639,2020-05-30,2020-06-29,['13'],"Expertises, Conseils, Etudes, Strategies Et Marketing",joue,directive24,appeloffre,initial,GRAND PORT MARITIME DE MARSEILLE,13226,Marseille,,['Etude'],[118],non,non
9,20-69653,2020-05-30,2020-08-25,['13'],Mission De Maîtrise D'oeuvre Pour Le Renforcement Du Reseau Electrique 20kv Destine Au Raccordement De Navires En Escales,joue,directive25,attribution,initial,GRAND PORT MARITIME DE MARSEILLE,13226,Marseille,"[('2020-04-30', 'Artelia Industrie', (304050, 'EUR'), None)]",['Ingénierie'],[455],non,non
10,20-69502,2020-05-30,2020-08-28,['13'],"Travaux dans le corps d'état : Réseaux sanitaires, vidanges, débouchages - 2 lots",joue,directive24,attribution,initial,Ville de Marseille,13233,Marseille cedex 20,"[('2020-05-28', 'ORTEC Environnement SAS', (2000000.0, 'EUR'), 'Travaux dans le corps d\'état ""Réseaux sanitaires, vidanges, débouchages"": 1er, 6e, 7e, 8e, 9e, 10e, 11e, 12e arrondissements et équipements rattachés'), ('2020-05-28', 'ORTEC Environnement SAS', (2000000.0, 'EUR'), 'Travaux dans le corps d\'état ""Réseaux sanitaires, vidanges, débouchages"": 2e, 3e, 4e, 5e, 13e, 14e, 15e, 16e arrondissements et équipements rattachés')]",['Sanitaire'],[319],oui,oui
11,20-69598,2020-05-30,2020-08-28,['13'],"Tierce Maintenance Applicative des applications spécifiques ou libres de la Ville de Marseille, développements et prestations associées",joue,directive24,attribution,initial,Ville de Marseille,13233,Marseille cedex 20,,['Informatique (prestations de services)'],[163],non,non
12,20-69507,2020-05-30,2020-07-04,"['13', '4', '5', '6', '83', '84']","Prestations de services d'insertion professionnelle de type "" AccélèR'emploi"" (ACL) à mettre en oeuvre auprès des demandeurs d'emploi de la région Provence-Alpes-Côte d'Azur",joue,directive24,appeloffre,initial,Pôle emploi PACA,13395,Marseille,,['Prestations de services'],[274],non,non
13,20-69390,2020-05-30,2020-06-30,['13'],Fourniture et livraison de gasoil non routier (Gnr),joue,directive24,appeloffre,initial,Ville d'Arles,13637,Arles,,"['Carburant, hydrocarbure']",[52],non,non
14,20-69529,2020-05-30,2020-06-29,['14'],2020ASP078 - Aménagement de la traverse de SAINT LOUP DE FRIBOIS sur la RD 101,joue,directive24,appeloffre,initial,DEPARTEMENT DU CALVADOS,14035,CAEN CEDEX,,['Voirie'],[365],non,non
15,20-68690,2020-05-30,2020-06-22,"['14', '49', '35', '86', '45']","le marché a pour objet la fourniture de prestations d'évolutions logicielles, maintenance et hébergement des applicatifs e-toile (rectificatif)",joue,autre,rectificatif,rectificatif,ASSOCIATION E-TOILE,14053,CAEN,,"['Informatique (prestations de services)', 'Logiciel', 'Informatique (assistance)', 'Informatique (maintenance serveurs et réseaux)']","[163, 186, 453, 454]",non,non
16,20-68085,2020-05-30,2020-07-08,['17'],Acquisition de fournitures et de matériels de bureaux,joue,directive24,appeloffre,initial,Cons. Départ. de la Charente-Maritime,17076,LA ROCHELLE,,"['Articles de bureau et articles scolaires', 'Consommables informatiques', 'Matériel de bureau']","[16, 68, 207]",non,oui
17,20-68081,2020-05-30,2020-07-06,['17'],travaux de démolitions et retrait de matériaux contenant de l'amiante dans les collèges et bâtiments départementaux,joue,directive24,appeloffre,initial,Cons. Départ. de la Charente-Maritime,17076,La Rochelle Cedex 9,,['Amiante (désamiantage)'],[479],non,non
18,20-63511,2020-05-30,2020-09-15,['17'],collecte et traitement des déchets industriels spéciaux et banals issus des activités maritimes et portuaires du conseil départemental de la charente-maritime,joue,directive24,appeloffre,initial,Cons. Départ. de la Charente-Maritime,17076,La Rochelle Cedex 9,,['Déchets non ménagers (prestations)'],[404],non,oui
19,20-69576,2020-05-30,2020-07-29,"['17', '16', '33', '79']",Fournitures Scolaires et Pédagogiques - Travaux manuels et livres,joue,directive24,attribution,initial,Communauté d'Agglomération de Saintes,17100,Saintes,"[('2020-02-21', 'Lacoste', (160000, 'EUR'), 'FOURNITURES SCOLAIRES'), ('2020-02-21', 'Pichon', (64000, 'EUR'), 'TRAVAUX MANUELS'), ('2020-02-21', 'Saliba', (48000, 'EUR'), ""MANUELS SCOLAIRES ET MATERIELS D'ACCOMPAGNEMENT"")]",['Papeterie'],[262],non,non
20,20-69301,2020-05-30,2021-10-01,['18'],Marché public global de performance pour la conception et l'exploitation d'un centre de tri interdépartemental,joue,directive24,appeloffre,initial,SPL TRI BERRY NIVERNAIS,18000,Bourges,,['Déchets non ménagers (prestations)'],[404],non,non
21,20-69490,2020-05-30,2020-06-29,['18'],TRANSPORTS DE PRELEVEMENTS POUR ANALYSES MEDICALES OU AUTRES TRANSPORTS DIVERSPOUR LES ETABLISSEMENTS DU GHT DU CHER,joue,directive24,appeloffre,initial,C.H. Jacques Coeur de Bourges,18020,BOURGES Cedex,,"['Analyses médicales, biologiques', 'Transport']","[8, 347]",oui,oui
22,20-69552,2020-05-30,2020-06-30,['18'],"MARCHE DEXPLOITATION DE CHAUFFAGE(P1 MTI, P2, P3, P3R)pour les besoins de la ville de MEHUN SUR YEVRE-",joue,directive24,appeloffre,initial,Ville de Mehun sur Yévre,18500,MEHUN SUR YEVRE,,"['Chauffage (exploitation, entretien)']",[59],non,non
23,20-69277,2020-05-30,2020-08-08,['19'],"Convoyage, entretien et contrôle technique règlementaire du parc poids lourds du SDIS 19",joue,directive24,appeloffre,initial,SDIS 19,19003,Tulle cedex,,['Véhicules'],[359],non,non
24,20-69476,2020-05-30,2020-07-20,"['21', '25']",consultation en vue des prélèvements et analyses du contrôle sanitaire des eaux de la région bourgogne franche-comté,joue,directive24,appeloffre,initial,Agence Régionale de Santé BFC,21035,Dijon Cedex,,['Prestations de services'],[274],oui,non
25,20-69320,2020-05-30,2020-06-12,['21'],Fourniture de repas en liaison froide,joue,autre,rectificatif,rectificatif,Ville de Longvic,21600,Longvic,,['Restauration collective'],[66],non,oui
26,20-69487,2020-05-30,2020-07-08,"['25', '70', '39', '90', '71', '38', '58', '21']",Systèmes d'impression petits et hauts volumes pour le GHT CFC AO 2020-23,joue,directive24,appeloffre,initial,CENTRE HOSPITALIER REGIONAL UNVT,25030,Besançon,,"['Abris', 'Impression']","[1, 160]",non,non
27,20-70317,2020-05-30,2020-07-03,['25'],Réalisation de deux forages de reconnaissance - Recherche de nouvelles ressources en eau,fns,cmp2006,appeloffre,initial,Pays de Montbéliard Agglomération,25208,MONTBELIARD,,['Forage'],[132],non,non
28,20-69492,2020-05-30,2020-06-30,['27'],"Levé de sites départementaux (Bâtiments, topographie, levé et détection de réseau, bornage)",joue,autre,rectificatif,rectificatif,Conseil Général de l'Eure,27021,Evreux cedex 01,,['Prestations de services'],[274],non,non
29,20-69268,2020-05-30,2020-07-28,['27'],Fourniture et livraison de denrées alimentaires en appprovisionnements directs de produits de l'agriculture pour la cuisine départementale du collège de Navarre d'Evreux,joue,directive24,attribution,initial,Conseil Général de l'Eure,27021,Evreux cedex 01,,['Denrées alimentaires'],[88],non,oui
30,20-70325,2020-05-30,2020-07-30,['27'],Travaux de démolition et construction d'un préau et d'un bloc sanitaire au collège Pierre Brossolette à Brionne,fns,cmp2006,attribution,initial,DEPARTEMENT DE L EURE,27021,Evreux cedex 01,"[('2020-04-30', 'TERRASSEMENT TP CREVEL', (25600.96, 'EUR'), None), ('2020-04-29', 'EIFFAGE CONSTRUCTION HAUTE NORMANDIE', (231807.19, 'EUR'), None), ('2020-04-29', 'R2C SAS', (157679.92, 'EUR'), None), ('2020-05-29', 'ENC-CGB', (137717.28, 'EUR'), None), ('2020-04-29', 'DELTAKLIMA', (50280.0, 'EUR'), None), ('2020-04-30', 'DUVAL ELECTRICITE', (39099.63, 'EUR'), None)]","[""Tous corps d'état""]",[345],oui,oui
31,20-69506,2020-05-30,2020-07-01,['28'],Maintenance des installations techniques de l'ensemble du patrimoine immobilierdu Conseil départemental d'Eure et Loir relance des lots 7-11-14-16,joue,directive24,appeloffre,initial,Conseil général d'Eure et Loir,28028,Chartres,,['Prestations de services'],[274],non,non
32,20-69437,2020-05-30,2020-06-28,['28'],Avis de résultat de concours de maîtrise d'oeuvre pour la réhabilitation du groupe scolaire des Bâtes,joue,directive24,attribution,initial,Commune de Dreux,28103,Dreux cedex,,"[""Maîtrise d'oeuvre""]",[197],non,non
33,20-69196,2020-05-30,2020-07-03,"['29', '56']",Fourniture et livraison de pièces détachées pour les véhicules et matériels de la Ville de Quimper,joue,directive24,appeloffre,initial,Ville de Quimper,29000,QUIMPER,,"['Equipement industriel', 'Equipements spécialisés', 'Matériel agricole, horticole', 'Mécanique']","[112, 115, 200, 221]",non,non
34,20-69337,2020-05-30,2020-07-07,['29'],Fourniture de Dispositifs Médicaux pour Abord Chirurgical - GHT de l'Union Hospitalière de Cornouaille,joue,directive24,appeloffre,initial,CH DE CORNOUAILLE,29107,Quimper cedex,,"['Consommables médicaux', 'Matériel médical']","[69, 212]",non,non
35,20-69299,2020-05-30,2020-06-29,"['29', '22', '35']","Contrôles annuels, vérification, maintenance et dépannage des moyens de lutte contre les risques incendie et de panique sur le patrimoine géré par la Ville de Morlaix",joue,directive24,attribution,initial,Ville de Morlaix,29671,Morlaix cedex,,['Détection incendie'],[90],non,non
36,20-69430,2020-05-30,2020-07-07,['31'],METEO-FRANCE2032F0052,joue,directive24,appeloffre,initial,METEO FRANCE,31057,TOULOUSE Cedex 01,,"['Informatique (prestations de services)', 'Prestations de services']","[163, 274]",non,non
37,20-69563,2020-05-30,2020-07-06,"['34', '31', '48', '66', '81', '82']",Organisation des salons Travail Avenir Formation (TAF),joue,directive24,appeloffre,initial,REGION OCCITANIE,31406,TOULOUSE,,['Evénementiel'],[445],non,non
38,20-69545,2020-05-30,2020-06-19,"['31', '34']",Evaluation environnementale stratégique du programme opérationnel régional FEDER-FSE Occitanie 2021-2027,joue,directive24,appeloffre,initial,REGION OCCITANIE,31406,TOULOUSE,,"['Audit', ""Assistance à maîtrise d'ouvrage""]","[21, 433]",non,non
39,20-69316,2020-05-30,2020-07-02,['31'],20mc0019aoo - Ac/Za - La Maintenance Des Moteurs Electriques - Annee 2020 A 2024,joue,directive24,appeloffre,initial,TOULOUSE METROPOLE,31505,Toulouse,,['Maintenance'],[196],non,non
40,20-69495,2020-05-30,2020-07-28,['33'],MAINTENANCE DES INSTALLATIONS ELECTRIQUES DU STADE CHABAN ET DES OUVRANTS MOTORISES HORS NORMES,joue,directive24,attribution,initial,Bordeaux Métropole,33045,BORDEAUX,"[('2020-02-28', 'EIFFAGE ENERGIE SYSTEMES - AQU', (2720000.0, 'EUR'), 'Maintenance des installations électriques du stade Chaban Delmas')]",['Maintenance'],[196],non,non
41,20-69212,2020-05-30,2020-06-19,['33'],formations professionnelles 3ème campagne - PRF 2020,joue,directive24,appeloffre,initial,Région Nouvelle Aquitaine,33077,Bordeaux,,['Formation'],[410],non,non
42,20-69330,2020-05-30,2020-06-30,['33'],FOURNITURE D'UN COMPACTEUR DE DECHETS POUR INSTALLATION DE STOCKAGE DES DECHETS NON DANGEREUX (CLASSE 2),joue,directive24,appeloffre,initial,SMICOTOM,33112,Saint Laurent Médoc,,"['Location (matériels)', 'Machines-outils']","[185, 194]",non,non
43,20-69315,2020-05-30,2020-06-30,['33'],Fourniture de 4 chargeuses pneumatiques pour le Pôle Environnement,joue,directive24,appeloffre,initial,COBAS,33260,La Teste De Buch,,['Location (matériels)'],[185],non,non
44,20-69509,2020-05-30,2020-06-29,['33'],Maintenance préventive et corrective des systèmes de sécurité incendie et du désenfumage et compartimentage pour le Groupement Hospitalier de Territoire Alliance Gironde - Relance,joue,directive24,appeloffre,initial,CHU DE BORDEAUX,33400,Talence,,['Maintenance'],[196],non,non
45,20-69664,2020-05-30,2020-06-29,['34'],"Acquisition de couples épareuses / accessoires, montage et formation pour l'ensemble des services du Conseil Départemental de l'Hérault",joue,directive24,appeloffre,initial,Conseil départemental de l'Hérault,34087,Montpellier,,"['Matériel agricole, horticole']",[200],non,non
46,20-64115,2020-05-30,2020-07-31,['34'],Travaux uniques sur les réseaux d'éclairage public et éclairage extérieur sur le territoire des communes adhérentes à hérault energies et ayant transféré la compétence investissement EP,joue,directive24,attribution,initial,Hérault Energies,34120,Pézenas,,['Eclairage public'],[102],non,non
47,20-69164,2020-05-30,2020-07-10,"['34', '12']",Fourniture de produits de 4eme et 5eme gamme et produits traiteurs pour le CHU de Montpellier etablissement support du GHT Est Herault et Sud Aveyron,joue,autre,rectificatif,rectificatif,CHU DE MONTPELLIER,34295,Monpellier,,['Denrées alimentaires'],[88],non,oui
48,20-69467,2020-05-30,2020-07-06,"['12', '34']",Entretien des espaces verts du CH et de l'EHPAD de Millau,joue,directive24,appeloffre,initial,CHU DE MONTPELLIER,34295,MONTPELLIER CEDEX 5,,['Espaces verts'],[116],non,oui
49,20-69435,2020-05-30,2020-07-01,['34'],Lycée Jean Mermoz à Montpellier,joue,directive24,appeloffre,initial,SEM ARAC OCCITANIE,34961,Montpellier cedex 2,,"['Bâtiment', 'Cloison, faux plafond', 'Couverture', 'Electricité (travaux)', 'Etanchéité', 'Gros oeuvre', 'Laboratoire (matériel)', 'Menuiserie', 'Peinture (travaux)', 'Ravalement', 'Revêtements de sols', 'Sanitaire', 'Serrurerie']","[33, 63, 74, 105, 117, 144, 188, 222, 264, 299, 308, 319, 321]",oui,non
50,20-68978,2020-05-30,2020-07-28,"['35', '22', '29', '56']",Accord-cadre pour la fourniture de peinture et d'outillage nécessaire au métier de peintre,joue,directive24,attribution,initial,Région Bretagne,35711,Rennes cedex 7,"[('2020-04-16', 'THEODORE MAISON DE PEINTURE', (600000, 'EUR'), 'Peinture spécifique et outillage nécessaire au métier de peintre'), ('2020-04-15', 'NUANCES UNIKALO', (400000, 'EUR'), 'peinture bio-sourcée')]",['Peinture (fourniture)'],[263],non,oui
51,20-69418,2020-05-30,2020-07-16,['56'],"COËTQUIDAN (56) - Location d'un bâtiment modulaire, y compris travaux d'installation et de repli",joue,directive24,appeloffre,initial,ESID de Rennes,35998,Rennes cedex 9,,['Bâtiment'],[33],non,non
52,20-64089,2020-05-30,2020-07-10,['38'],travaux et maintenance éclairage public 2021-2024,joue,directive24,appeloffre,initial,Territoire d'Energie Isère - TE38,38000,GRENOBLE,,['Eclairage public'],[102],non,non
53,20-69313,2020-05-30,2020-07-06,['38'],Fourniture de matériel horticole - relance des lots 1 et 2,joue,directive24,appeloffre,initial,COMMUNE DE GRENOBLE,38021,Grenoble,,"['Matériel agricole, horticole']",[200],non,non
54,20-69360,2020-05-30,2020-06-30,['38'],Achat de légumes et fruits de saison et de pomme de terre destiné à promouvoir une consommation citoyenne,joue,directive24,appeloffre,initial,DEPARTEMENT DE L ISERE,38022,Grenoble,,['Denrées alimentaires'],[88],non,oui
55,20-69359,2020-05-30,2020-06-30,['38'],Achat de produits issus de l'agriculture biologique et produits labellisés destiné à promouvoir une consommation citoyenne,joue,directive24,appeloffre,initial,DEPARTEMENT DE L ISERE,38022,Grenoble,,['Denrées alimentaires'],[88],non,oui
56,20-69652,2020-05-30,2020-08-25,['38'],Achat de bons cadeaux pour les sportifs de haut-niveau du Département de l'Isère,joue,directive24,attribution,initial,DEPARTEMENT DE L ISERE,38022,Grenoble,"[('2020-01-21', 'Titres Cadeaux', (65986.8, 'EUR'), None)]","['Prestations de services', 'Carte magnétique, carte à puce', 'Chèque cadeau']","[274, 403, 436]",non,non
57,20-69332,2020-05-30,2020-07-10,['38'],Marché d'assurances,joue,directive24,appeloffre,initial,Ville de St Quentin Fallavier,38070,Saint Quentin Fallavier,,['Assurance'],[20],non,non
58,20-69451,2020-05-30,2020-06-30,['43'],"Maintenance, entretien et dépannage des ascenseurs, monte-personnes, monte-charges, barrières, portes, portails, rideaux semi-automatiques et automatiques",joue,directive24,appeloffre,initial,COMMUNAUTE D AGL DU PUY EN VELAY,43003,Le Puy en Velay,,"['Ascenseur', 'Maintenance', 'Porte automatique, portail']","[17, 196, 412]",non,non
59,20-69656,2020-05-30,2020-08-25,['43'],Fourniture de consommables et de matériels dédiés à l'assistance technique du Département pour l'assainissement collectif et au suivi de la qualité des cours d'eau,joue,directive24,attribution,initial,DEPARTEMENT DE LA HAUTE LOIRE,43009,Le Puy En Velay Cedex,"[('2020-03-30', 'Cpil', (240000, 'EUR'), None)]","['Consommables médicaux', 'Laboratoire (matériel)']","[69, 188]",non,non
60,20-69655,2020-05-30,2020-08-25,['43'],Numéro de la consultation : 2019-Dsi-0022 Accompagnement pour la mise en oeuvre de la solution Georchestra et développements complémentaires de la solution Mviewer,joue,directive24,attribution,initial,DEPARTEMENT DE LA HAUTE LOIRE,43009,Le Puy En Velay Cedex,"[('2020-03-30', 'Camptocamp France', (130000, 'EUR'), None)]",['Informatique (prestations de services)'],[163],non,non
61,20-69521,2020-05-30,2020-08-25,['43'],Achat de services de télécommunications,joue,directive24,attribution,initial,DEPARTEMENT DE LA HAUTE LOIRE,43009,Le Puy En Velay Cedex,"[('2020-03-30', 'Orange', (750000, 'EUR'), None)]","['Abonnement', 'Fibre optique', 'Informatique (prestations de services)']","[2, 133, 163]",non,non
62,20-69593,2020-05-30,2020-06-29,['43'],Transports scolaires affectés aux élèves en situation de handicap,joue,directive24,appeloffre,initial,DEPARTEMENT DE LA HAUTE LOIRE,43009,Le Puy En Velay Cedex,,['Transport'],[347],non,non
63,20-69670,2020-05-30,2020-08-25,['43'],Balayage De Rejets D'Enduits Année 2020 (2021-2022-2023),joue,directive24,attribution,initial,DEPARTEMENT DE LA HAUTE LOIRE,43009,Le Puy En Velay Cedex,"[('2020-03-30', 'Auvergne Nettoiement Service', (218800, 'EUR'), None)]",['Voirie'],[365],non,non
64,20-69671,2020-05-30,2020-08-25,['43'],Mission de maîtrise d'oeuvre pour l'aménagement de la Maison Départementale de l'Autonomie et d'un data center dans un bâtiment existant,joue,directive24,attribution,initial,DEPARTEMENT DE LA HAUTE LOIRE,43009,Le Puy En Velay Cedex,"[('2020-03-23', 'Eurl Didier Allibert', (212450, 'EUR'), None)]","[""Maîtrise d'oeuvre""]",[197],non,non
65,20-69523,2020-05-30,2020-08-25,['43'],Fourniture De Pieces Detachees Vehicules Renault (Pl et Vl),joue,directive24,attribution,initial,DEPARTEMENT DE LA HAUTE LOIRE,43009,Le Puy En Velay Cedex,,['Pièces détachées'],[266],non,non
66,20-69542,2020-05-30,2020-09-14,['44'],Fourniture de produits lessiviels pour les blanchisseries du GHT44 (3 lots),joue,autre,rectificatif,rectificatif,CHU de Nantes,44093,Nantes cedex,,"[""Produits d'entretien""]",[278],non,non
67,20-69504,2020-05-30,2020-07-10,['44'],PRESTATION D'AFFRANCHISSEMENT PAR MASSIFICATION ET COLLECTE ET DISTRIBUTION DE COURRIERS NON AFFRANCHIS (2 LOTS),joue,directive24,appeloffre,initial,CHU de Nantes,44093,Nantes cedex,,['Boîtes aux lettres'],[41],non,non
68,20-69667,2020-05-30,2020-06-22,['45'],"Acquisition et mise en oeuvre d'une solution de gestion du transport scolaire, maintenance et prestations associées",joue,autre,rectificatif,rectificatif,REGION CENTRE VAL DE LOIRE,45041,Orleans,,"['Informatique (prestations de services)', 'Informatique (assistance)']","[163, 453]",non,non
69,20-69624,2020-05-30,2020-07-06,['47'],MARCHE DE FOURNITURE D'ENERGIE D'EXPLOITATION ET DE MAINTENANCE DES INSTALLATIONS DE CHAUFFAGE ET CLIMATISATION DES BATIMENTS DU DEPARTEMENT DE LOT ET GARONNE,joue,directive24,appeloffre,initial,Département de Lot-et-Garonne,47922,Agen cedex 9,,"['Chauffage (exploitation, entretien)', 'Prestations de services']","[59, 274]",non,oui
70,20-69239,2020-05-30,2020-06-27,['47'],MARCHE DE FOURNITURE D'ENERGIE D'EXPLOITATION ET DE MAINTENANCE DES INSTALLATIONS DE CHAUFFAGE ET CLIMATISATION DES BATIMENTS DU DEPARTEMENT DE LOT ET GARONNE,joue,directive24,attribution,initial,Département de Lot-et-Garonne,47922,Agen cedex 9,,"['Chauffage (exploitation, entretien)', 'Prestations de services']","[59, 274]",non,non
71,20-69252,2020-05-30,2020-06-29,['49'],Maintenance des courants faibles du patrimoine locatif de Maine-et-Loire Habitat,joue,directive24,appeloffre,initial,MAINE LOIRE HABITAT OFFICE PUB HABITAT,49001,Angers,,['Maintenance'],[196],non,non
72,20-69380,2020-05-30,2020-07-03,['49'],"Marché de Maîtrise d'Oeuvre pour la Construction de 95 logements collectifs en locatifs, en accession et de 2 locaux commerciaux, ilot C1 ZAC Mayenne à Avrillé (49)",joue,directive24,appeloffre,initial,SOCLOVA,49004,ANGERS CEDEX 01,,"[""Maîtrise d'oeuvre""]",[197],non,non
73,20-69564,2020-05-30,2020-07-28,['49'],acquisition de fournitures de bureau,joue,directive24,attribution,initial,Angers Loire Métropole,49020,Angers,"[('2020-02-20', 'LYRECO FRANCE', (161589.75, 'EUR'), None)]",['Articles de bureau et articles scolaires'],[16],non,oui
74,20-69603,2020-05-30,2020-08-25,['50'],Prestation de remplacement temporaire et renfort de personnel municipal (Relance suite à une première consultation déclarée sans suite),joue,directive24,attribution,initial,COMMUNE DE SAINT LO,50010,Saint-Lô,"[('2020-05-07', ""Initiatives Pour L'Emploi"", (375000, 'EUR'), None)]",['Mise à disposition de personnel'],[461],non,non
75,20-69245,2020-05-30,2020-06-30,['50'],Nettoyage et entretien des vitreries et des locaux des bâtiments de la Communauté d'Agglomération du Cotentin,joue,directive24,appeloffre,initial,Communauté d'Agglomération du Cotentin,50130,Cherbourg en Cotentin,,['Nettoyage de locaux'],[239],non,oui
76,20-69612,2020-05-30,2020-07-21,['50'],Fourniture de repas sans boisson alcoolisée et démarche qualité du service cuisine,joue,directive24,appeloffre,initial,cias du val de see,50370,Brecey,,['Denrées alimentaires'],[88],non,non
77,20-69485,2020-05-30,2020-06-29,['51'],Maintenance des installations et équipements techniques des serres municipales,joue,directive24,appeloffre,initial,VILLE DE REIMS,51722,Reims cedex,,['Maintenance'],[196],non,non
78,20-69580,2020-05-30,2020-06-30,['51'],AMO - Contrôle convention DSP exploitation centre valorisation énergétique déchets,joue,directive24,appeloffre,initial,Communauté urbaine du Grand Reims,51722,Reims cedex,,"['Prestations de services', ""Assistance à maîtrise d'ouvrage""]","[274, 433]",non,non
79,20-69312,2020-05-30,2020-06-30,['53'],Contournement de Cossé-le-Vivien - Travaux d'aménagements paysagers,joue,directive24,appeloffre,initial,DEPARTEMENT DE LA MAYENNE,53014,Laval,,['Espaces verts'],[116],non,non
