,a00_cle_idweb,g04_01_date_publication,g04_03_date_fin_diffusion,g04_07_dep_publication,g04_09_resume_objet,g01_02_01_famille,g01_02_02_perimetre,g01_02_03_nature,g01_02_04_statut,d01_01_denomination,d01_07_cp,d01_08_ville,d08_09_decision_titulaireandRENSEIGNEMENT,g04_052_descripteurs_libelles,g04_051_descripteurs_codes,g04_061_criteres_sociaux,g04_062_criteres_environnementaux
328,20-51534,2020-04-10,2020-05-29,['76'],Elaboration d'un schéma directeur de scénographie urbaine sur la commune de lillebonne 76170,mapa,cmp2006,appeloffre,initial,Communauté d'Agglomération Caux vallée,76170,Lillebonne,,['Prestations de services'],[274],non,non
329,20-51555,2020-04-10,2020-04-27,['76'],Marché de prestations de services d'assurance - Souscription d'un contrat d'assurance - Dommage-Ouvrage relatif aux travaux d'extension et la rénovation de la patinoire Guy Boissiè,fns,cmp2006,appeloffre,rectificatif,METROPOLE ROUEN NORMANDIE,76176,ROUEN,,['Assurance'],[20],non,non
330,20-51217,2020-04-10,2020-05-18,['76'],Fourniture et livraison de chlore gazeux pour le traitement de l'eau potable,fns,cmp2006,appeloffre,initial,METROPOLE ROUEN NORMANDIE,76176,ROUEN,,['Alimentation en eau potable'],[6],non,oui
331,20-50261,2020-04-10,2020-07-06,['76'],"Marche Exploitation De Chauffage, De Production Ecs, De Ventilation, De Climatisation, De Groupes Electrogenes,Equipements Annexes Avec Gros Entretien Renouvellement De Certains Et",joue,directive24,attribution,initial,CENTRE HOSPITALIER DE DIEPPE,76200,Dieppe,"[('2019-12-18', 'Dalkia', (233659, 'EUR'), None)]","['Chauffage (exploitation, entretien)', 'Maintenance']","[59, 196]",non,non
332,20-51161,2020-04-10,2020-05-20,"['76', '27']",CONSULTATION POUR L'ETUDE DE L'HABITAT EN VUE DE LA CREATION D'UN RESEAU DE COLLECTE DES EAUX USEES SUR LE QUARTIER DE L'ESPLANADE A DIEPPE,mapa,cmp2006,appeloffre,initial,Cté d'agglo. de la Région Dieppoise,76204,DIEPPE CEDEX,,['Prestations de services'],[274],non,non
333,20-50458,2020-04-10,2020-05-11,"['76', '27']",maîtrise d'oeuvre pour la restructuration et l'extension des systèmes d'assainissement du secteur de la basse vallée de la sâane,joue,directive24,appeloffre,initial,CDC Terroir de Caux,76730,Bacqueville en Caux,,"['Assainissement', 'Canalisations', ""Maîtrise d'oeuvre"", ""Station d'épuration (travaux)"", 'Station de refoulement']","[18, 48, 197, 328, 334]",non,non
334,20-51236,2020-04-10,2020-06-10,['76'],Acquisition d'un Autoclave pour l'IUT d'Évreux,fns,cmp2006,attribution,initial,Université de Rouen,76821,Mont saint aignan cedex,[],['Equipements spécialisés'],[115],non,non
335,20-50281,2020-04-10,2020-06-02,['77'],Fourniture et livraison de produits d'entretien pour les besoins des services du Département de Seine-et-Marne et des collèges publics du département,joue,directive24,attribution,initial,Département de Seine-et-Marne,77010,Melun,"[('2020-02-17', 'HERSAND', (134748.87, 'EUR'), ""Fourniture de petits matériels de nettoyage et d'entretien et consommables (produits d'entretien et articles à usage unique)""), ('2019-02-13', 'DIC', (131655.89, 'EUR'), ""Gros matériels de nettoyage et d'entretien"")]",['Nettoyage de locaux'],[239],non,oui
336,20-50280,2020-04-10,2020-06-02,['77'],La fourniture et la livraison de denrées alimentaires,joue,directive24,attribution,initial,Département de Seine-et-Marne,77010,Melun,"[('2020-02-17', 'PRO A PRO', (730885, 'EUR'), 'EPICERIE (conventionnelle et bio)'), ('2020-02-13', 'SYSCO SAS', (592617, 'EUR'), 'POISSONS ET DERIVES SURGELES (conventionnelle et bio)'), ('2020-02-13', 'SYSCO SAS', (447029, 'EUR'), 'VIANDES, VOLAILLES ET PRODUITS ELABORES SURGELES(conventionnel et bio)'), ('2020-02-13', 'SURGELES DISVAL', (404900, 'EUR'), 'FRUITS ET LEGUMES SURGELES (conventionnel et bio)'), ('2020-02-13', 'SURGELES DISVAL', (123362, 'EUR'), 'GLACES ET PATISSERIES SURGELEES (conventionnelle et bio)'), ('2020-02-13', 'PASSION FROID GROUPE POMONA', (1091511, 'EUR'), 'PRODUITS LAITIERS ET BOF (conventionnel et bio)')]",['Denrées alimentaires'],[88],non,oui
337,20-50236,2020-04-10,2020-08-11,['77'],"Prestations de nettoyage des locaux d'externat et de la zone de restauration (hors production), de plonge laverie et batterie dans des collèges publics du Département de Seine et Marne",joue,autre,rectificatif,rectificatif,Département de Seine-et-Marne,77010,Melun,,['Nettoyage de locaux'],[239],non,oui
338,20-50628,2020-04-10,2020-05-13,['77'],Acquisition et maintenance de Distributeurs automatiques de vêtements (DAV),joue,directive24,appeloffre,initial,GPT COOPERATION SANITAIRE BLANCHISSERI,77100,Meaux,,['Blanchisserie (matériel)'],[37],non,non
339,20-50409,2020-04-10,2020-06-06,['77'],L'acquisition de pièces détachées mécaniques et accessoires pour matériel horticole,joue,directive24,attribution,initial,PARIS VALLEE DE LA MARNE,77207,Marne la vallee cedex 1,,"['Matériel agricole, horticole']",[200],non,oui
340,20-50115,2020-04-10,2020-05-04,['77'],"travaux d'enfouissement des réseaux enedis basse tension, orange, eclairage public rue du viaduc à avon",fns,cmp2006,appeloffre,initial,Commune d'Avon,77210,Avon,,"['Eclairage public', 'Réseaux divers', 'Voirie']","[102, 306, 365]",non,non
341,20-50340,2020-04-10,2020-04-20,['77'],Fourniture et pose et maintenance de conteneurs enterrés sur le territoire du SMICTOM de la Région de Fontainebleau,joue,directive24,attribution,initial,SMICTOM de la Région de Fontainebleau,77250,MORET LOING ET ORVANNE,,"['Conteneur, poubelles', 'Equipements spécialisés', 'Maintenance']","[71, 115, 196]",non,non
342,20-50411,2020-04-10,2020-04-20,['77'],Service de maintenance du parc de conteneurs,joue,directive24,attribution,initial,SMICTOM de la Région de Fontainebleau,77250,MORET LOING ET ORVANNE,"[('2020-03-17', 'AIPREFON', (1083520, 'EUR'), 'Service de maintenance du parc de conteneurs')]",['Prestations de services'],[274],oui,non
343,20-50686,2020-04-10,2020-05-25,['77'],Groupement de commandes de la Ville de Villeparisis et son Ccas pour des prestations de services d'assurances,joue,directive24,appeloffre,initial,COMMUNE DE VILLEPARISIS,77273,Villeparisis,,['Assurance'],[20],non,non
344,20-50268,2020-04-10,2020-05-27,"['78', '75', '76', '77', '91', '92', '93', '94', '95']","Souscription et gestion du contrat d'assurance "" Flotte automobile - Auto missions """,joue,directive24,appeloffre,initial,IEED VEDECOM,78000,Versailles,,"['Assurance', 'Prestations de services']","[20, 274]",non,non
345,20-50696,2020-04-10,2020-05-18,['78'],"Travaux de voirie, de signalisation horizontale et de réseaux secs dans diverses rues de Versailles et dans les zones de compétences déléguées de Versailles Grand Parc",joue,directive24,appeloffre,initial,ville de Versailles,78011,Versailles,,"['Réseaux divers', 'Signalisation', 'Voirie']","[306, 322, 365]",non,non
346,20-50479,2020-04-10,2020-05-11,['78'],Numérisation à valeur probante des documents des directions du Département des Yvelines,joue,autre,rectificatif,rectificatif,Conseil départemental des Yvelines,78012,Versailles,,['Numérisation'],[463],non,non
347,20-50829,2020-04-10,2020-07-30,['78'],"acquisition d'un filet anti-chaleurs autoporté et de vérifier sa compatibilité avec le char leclerc, dans des conditions de très fortes chaleurs, dans le cadre de (l'evta double-peau). (rectificatif)",fns,cmp2006DEFENSE,appeloffre,rectificatif,Section Technique de l'armée de terre,78013,Versailles cedex,,['Bâche'],[435],non,non
348,20-50414,2020-04-10,2020-05-15,"['78', '60']",Accord-cadre à bons de commande portant sur la réalisation de missions de contrôle technique,joue,directive24,appeloffre,initial,ESID IDF,78102,Saint germain en laye cedex,,['Contrôle technique'],[72],non,non
349,20-50755,2020-04-10,2020-05-28,['78'],Administration et exploitation des réseaux informatiques,joue,autre,rectificatif,rectificatif,COMMUNE DU VESINET,78116,Le Vésinet,,"['Informatique (prestations de services)', 'Informatique (maintenance serveurs et réseaux)']","[163, 454]",non,non
350,20-50551,2020-04-10,2020-07-06,['78'],Maitrise d'oeuvre pour la mise en oeuvre du contrat de pôle de la gare de La Verrière,joue,directive24,attribution,initial,C.A. de Saint-Quentin-en-Yvelines,78192,Trappes,"[('2020-03-09', 'Arep Ville', (753775, 'EUR'), None)]","[""Maîtrise d'oeuvre""]",[197],non,non
351,20-51136,2020-04-10,2020-06-08,['78'],Travaux d'extension du réseau d'eaux usées sur la commune d'Andrésy,fns,cmp2006,appeloffre,initial,GRAND PARIS SEINE ET OISE,78410,Aubergenville,,['Assainissement'],[18],non,non
352,20-50768,2020-04-10,2020-06-09,['78'],Délégation de service public pour la gestion de la gare routière de Mantes-en-Yvelines et d'un local conducteur du pôle gare de Rosny-sur-Seine,joue,directive23,attribution,initial,GRAND PARIS SEINE ET OISE,78410,Aubergenville,"[('2019-10-03', 'RATP Développement - Transports Voyageurs du Mantois', (2749496, 'EUR'), ""Gestion de la gare routière de Mantes-en-Yvelines et d'un local conducteur du pôle gare de Rosny-sur-Seine"")]",['Prestations de services'],[274],non,non
353,20-51304,2020-04-10,2020-05-14,['78'],Maintenance préventive des équipements d'aires de jeux collectives de la Ville de Triel-sur-Seine,mapa,cmp2006,appeloffre,initial,Commune de Triel sur Seine,78510,Triel sur Seine,,['Aire de jeux'],[400],non,non
354,20-51578,2020-04-10,2020-05-11,['78'],La présente opération concerne la rénovation et la réhabilitation d'une salle de classe RASED et la rénovation complète de la toiture de l'école élémentaire. La description des travaux et le,fns,cmp2006,appeloffre,initial,VILLE DE MEZIERES SUR SEINE,78970,Mezieres-sur-seine,,['Bâtiment'],[33],non,non
355,20-50612,2020-04-10,2020-05-26,['80'],Maîtrise d'oeuvre requalification et résidentialisation quartier Soleil Levant à Abbeville (80),joue,directive24,appeloffre,initial,Baie de Somme Habitat,80102,Abbeville cedex,,"[""Maîtrise d'oeuvre""]",[197],non,non
356,20-50395,2020-04-10,2020-04-30,"['80', '2', '60', '59', '62']",suivi animation d'une opération programmée d'amélioration de l'habitat et revitalisation rurale (rectificatif),joue,autre,rectificatif,rectificatif,COMMUNAUTE DE COMMUNES DE LA HTE SOMME,80201,Péronne,,['Prestations de services'],[274],non,non
357,20-51179,2020-04-10,2020-05-04,['80'],"Isolation de l'école élémentaire Paul Langevin, mises aux normes des sanitaires du rez-de-chaussée,mise en place de la VMC et création d'une rampe d'accessibilité.",fns,cmp2006,appeloffre,initial,MAIRIE DE CAMON,80450,Camon,,['Isolation'],[169],non,non
358,20-50309,2020-04-10,2020-05-29,['82'],"Marché Public Global de Performance - gestion énergétique, exploitation, maintenance, modernisation et extension des installations d'éclairage public et mises en valeur du patrimoi",joue,directive24,appeloffre,initial,Ville de Montauban,82013,Montauban Cedex,,['Eclairage public'],[102],non,oui
359,20-46358,2020-04-10,2020-05-14,['82'],restauration scolaire en liaison froide pour la commune de caussade,fns,cmp2006,appeloffre,initial,Ville de Caussade,82303,Caussade Cedex,,['Restauration collective'],[66],non,non
360,20-51222,2020-04-10,2020-04-24,['83'],Travaux d'économie et de modernisation des installations thermiques au Collège Marie Curie à la Seyne sur Mer,fns,cmp2006,appeloffre,rectificatif,Conseil Général du Var,83000,TOULON,,['Chauffage (travaux)'],[61],non,non
361,20-50212,2020-04-10,2021-04-08,['83'],mise en accessibilité du site de l'ecoferme de la barre à Toulon - LOT1,joue,directive24,modification,modification,Conseil Général du Var,83000,Toulon,"[('2019-09-09', ' Idverde ', (405499.52, 'EUR'), 'aménagements extérieurs')]","['Espaces verts', 'Mur de soutènement', 'Sanitaire']","[116, 233, 319]",non,non
362,20-51567,2020-04-10,2020-07-08,['83'],MISE À DISPOSITION DE MÉDIATEURS EXTERNES POUR INTERVENIR SUR DES SITUATIONS DE CONFLITS REPÉRÉS AU SEIN D'UNITÉS DE TRAVAIL AU DÉPARTEMENT DU VAR,fns,cmp2006,attribution,initial,Conseil Général du Var,83076,TOULON,"[('2020-03-24', 'EPISTEME', (100000, 'EUR'), None)]",['Prestations de services'],[274],non,non
363,20-50674,2020-04-10,2021-04-09,['83'],maîtrise d'oeuvre pour la création d'un espace d'exposition dans la maison des associations 1 boulev,joue,directive24,modification,modification,Conseil Général du Var,83076,Toulon,"[('2017-09-20', 'Frédéric Pasqualini Architecte ', (345724.37, 'EUR'), None)]","[""Maîtrise d'oeuvre"", ""Mission d'ordonnancement, pilotage, coordination (OPC)""]","[197, 234]",non,non
364,20-51601,2020-04-10,2020-05-25,['83'],Travaux d'aménagement des espaces urbains par la création de structures d'ombrage et prestations associées pour la Commune de Sanary-sur-Mer,fns,cmp2006,appeloffre,initial,COMMUNE DE SANARY SUR MER,83112,Sanary sur Mer,,"['Fondations spéciales', 'Mobilier urbain']","[129, 231]",non,oui
365,20-50717,2020-04-10,2020-05-15,"['83', '6', '13']",Mission de maîtrise d'oeuvre pour la réalisation d'un lotissement de 14 lots individuels et 1 lot collectif puis la construction d'un bâtiment collectif,joue,directive24,appeloffre,initial,SAGEM,83130,LA GARDE,,"[""Maîtrise d'oeuvre"", 'Matériaux de construction']","[197, 198]",non,non
366,20-50201,2020-04-10,2020-06-05,['83'],Marché de services d'assurances pour les besoins de la Ville d'Ollioules,joue,directive24,appeloffre,initial,Commune d'Ollioules,83191,Ollioules Cedex,,['Assurance'],[20],non,non
367,20-51459,2020-04-10,2020-04-30,['83'],Fourniture de produits spécifiques,mapa,cmp2006,attribution,initial,Ville de Draguignan (83),83300,Draguignan,,"['Produits chimiques', ""Produits d'entretien""]","[275, 278]",non,non
368,20-51445,2020-04-10,2020-05-15,['83'],"Missions de contrôles techniques, assistances techniques et diagnostics immobiliers et divers",fns,cmp2006,appeloffre,initial,Ville de Draguignan (83),83300,Draguignan,,"['Assistance technique', 'Contrôle technique']","[19, 72]",non,non
369,20-50432,2020-04-10,2020-07-06,['83'],Bâtiments - Travaux d'entretien et de grosses réparations de menuiseries - Procédure Adaptée - Accord-cadre à bons de commande - Années 2020 à 2023,joue,directive24,attribution,initial,Commune d'Hyères-les-Palmiers,83412,Hyères,"[('2020-03-15', 'Sas Sptmi', (666666, 'EUR'), None)]",['Menuiserie'],[222],non,oui
370,20-51351,2020-04-10,2020-05-15,['83'],Extension du système de vidéoprotection,fns,cmp2006,appeloffre,initial,Ville de Saint Mandrier sur Mer,83430,Saint Mandrier sur Mer,,['Surveillance'],[331],non,non
371,20-50321,2020-04-10,2020-04-30,['83'],Service de gestion du centre de loisirs sans hébergement et de l'accueil périscolaire des enfants âgés de 3 à 14 ans,joue,directive24,appeloffre,initial,COMMUNE DE LA GARDE FREINET,83680,La Garde Freinet,,['Prestations de services'],[274],non,non
372,20-50297,2020-04-10,2020-06-12,['83'],2020AO027,joue,directive24,appeloffre,initial,ville de saint tropez,83990,Saint-tropez,,['Combustible'],[438],non,non
373,20-51168,2020-04-10,2020-07-08,['87'],Etudes de faisabilité et de programmation pour la restructuration des équipements scolaires des quartiers de Beaubreuil et du Val de l'Aurence,fns,cmp2006,attribution,initial,COMMUNE DE LIMOGES,87031,LIMOGES CEDEX 1,"[('2020-04-08', 'HEMIS AMO', (69500, 'EUR'), None), ('2020-04-08', 'CRESCENDO SO', (26000, 'EUR'), None)]",['Prestations de services'],[274],non,non
374,20-51629,2020-04-10,2020-06-10,['87'],MAPA 20-01 Fourniture de services de télécommunications mobiles pour le compte des sites Dom de l'ASP,fns,cmp2006,appeloffre,rectificatif,Agence de services et de paiement,87040,Limoges,,['Télécommunications'],[338],non,non
375,20-50205,2020-04-10,2020-06-12,['89'],fourniture de polymères cationiques pour la station d'épuration de la communauté d'agglomération du grand sénonais (rectificatif),joue,autre,rectificatif,rectificatif,Communauté d'Agglomération gd Sénonais,89100,Sens,,['Produits chimiques'],[275],non,non
376,20-51253,2020-04-10,2020-05-15,"['89', '45', '21', '10', '77']",Fourniture et travaux de pose d'une aire de jeux - Théâtre de Verdure,fns,cmp2006,appeloffre,initial,Commune de Saint Florentin,89600,Saint-florentin,,['Aire de jeux'],[400],non,non
377,20-51469,2020-04-10,2020-05-19,['89'],Location et maintenance de copieurs,mapa,cmp2006,appeloffre,initial,Commune de Saint Florentin,89600,Saint-florentin,,['Reprographie'],[305],non,non
378,20-51322,2020-04-10,2020-05-06,['91'],Organisation de la manifestation TECHINNOV 2021,dsp,dsp,appeloffre,initial,CCI de l'Essonne,91004,Evry cedex,,['Prestations de services'],[274],non,non
379,20-51337,2020-04-10,2020-05-06,"['91', '92', '94', '78', '75']",Réalisation de prestations évènementielles et création d'un évènement emblématique commémoratif autour de lanniversaire de lENSTA Paris,fns,cmp2006,appeloffre,rectificatif,ENSTA,91120,Palaiseau,,['Evénementiel'],[445],non,non
380,20-51265,2020-04-10,2020-06-15,['57'],Modernisation des cellules HTA du campus de Metz de CentraleSupélec,fns,cmp2006,appeloffre,rectificatif,CENTRALESUPELEC,91190,Gif-sur-yvette,,['Electricité (travaux)'],[105],non,non
381,20-50584,2020-04-10,2020-05-04,['91'],travaux de requalification du trottoir est de l'avenue du maréchal leclerc à massy - 3 lots (rectificatif),joue,autre,rectificatif,rectificatif,COMMUNE DE MASSY,91300,Massy,,['Voirie'],[365],oui,non
382,20-50553,2020-04-10,2020-05-19,"['92', '75', '14', '76', '27', '60', '2', '51', '89']",Prestations de traiteurs pour l'Agence de l'eau Seine-Normandie,joue,directive24,appeloffre,initial,Agence de l'eau Seine-Normandie,92027,Nanterre cedex,,['Prestations de services'],[274],oui,oui
383,20-50579,2020-04-10,2020-05-11,['92'],Conseil juridique de la DGEC relatif à la régulation du marché de l'électricité,joue,directive24,appeloffre,initial,MEDDTL - DGEC - SD7,92055,Paris la défense cedex,,['Assistance juridique'],[434],non,non
384,20-51299,2020-04-10,2020-05-01,"['92', '75']",Création de l'écolabel 'Flux logistiques portuaires' et lancement d'une expérimentation sur l'axe Méditérranée-Rhône-Saône,fns,cmp2006,appeloffre,rectificatif,MEEDDAT,92055,La défense cédex,,['Dragage'],[93],non,non
385,20-51521,2020-04-10,2020-04-27,['92'],Organisation du Forum de la Rentrée pour la Ville d'Issy-les-Moulineaux,fns,cmp2006,appeloffre,initial,GPSO POUR ISSY LES MOULINEAUX,92130,Issy-les-moulineaux,,['Spectacle'],[472],non,non
386,20-50341,2020-04-10,2020-07-01,['92'],"Prestations de maintenance, fourniture et installation d'équipements et matériels de restauration et de buanderie",joue,directive24,attribution,initial,Ville de Clamart,92140,Clamart,"[('2020-04-03', 'LFC Avond Services', (1, 'EUR'), ""Prestations de maintenance, fourniture et installation d'équipements et matériels de restauration et de buanderie"")]",['Maintenance'],[196],non,non
387,20-51138,2020-04-10,2020-05-11,"['92', '75']",acquisition et mise en oeuvre d'un système d'information ressources humaines pour la ville de bagneux,fns,cmp2006,appeloffre,initial,Ville de Bagneux,92220,Bagneux,,['Logiciel'],[186],non,non
388,20-50732,2020-04-10,2020-06-01,['92'],Travaux de construction du centre technique municipal - phase 2,joue,autre,rectificatif,rectificatif,Ville de Malakoff,92245,Malakoff Cedex,,"['Etanchéité', 'Gros oeuvre', 'Menuiserie', 'Peinture (travaux)', 'Revêtements de sols']","[117, 144, 222, 264, 308]",non,non
389,20-49423,2020-04-10,2020-04-27,['92'],nomination des commissaires aux comptes (titulaire et suppleant),joue,directive24,attribution,initial,Fédération française de golf,92309,Levallois-Perret,,"['Audit', 'Prestations de services']","[21, 274]",non,non
390,20-50187,2020-04-10,2020-04-17,"['92', '75']",Mission de commissariat aux comptes pour CCI France - Exercices 2020 à 2025,joue,autre,rectificatif,rectificatif,ACFCI,92309,Levallois-Perret Cedex,,['Audit'],[21],non,non
391,20-51593,2020-04-10,2020-06-26,['92'],Appel à manifestation d'intérêt,fns,cmp2006,appeloffre,rectificatif,CENTRE EVENEMENTIEL ET CULTUREL,92400,COURBEVOIE,,"['Repas, traiteur']",[304],non,non
392,20-51219,2020-04-10,2020-05-11,['92'],Rénovation du terrain de rugby du stade Jean-Pierre Rives à Courbevoie,fns,cmp2006,appeloffre,initial,Ville de Courbevoie,92401,Courbevoie,,"['Terrassement', 'Terrain de sport']","[341, 342]",non,oui
393,20-50683,2020-04-10,2020-08-02,"['78', '74', '95']",Extension de capacité du lycée Camille Claudel à Mantes-la-Ville,joue,directive24,appeloffre,initial,Région Ile de France,92445,Issy-les-moulineaux cedex,,"['Abris', 'Travaux agricoles']","[1, 348]",non,non
394,20-51507,2020-04-10,2020-05-04,"['92', '75']",Travaux de rénovation intérieure de divers locaux et du garage à bateaux du Complexe sportif situé sur l'Ile du Pont à Neuilly-sur-Seine,fns,cmp2006,appeloffre,initial,Ville de Neuilly-sur-Seine,92522,Neuilly-sur-seine cedex,,['Peinture (travaux)'],[264],non,non
395,20-51453,2020-04-10,2020-06-10,['92'],Marché de travaux de remplacement des portes palières des logements de Hauts de Seine Habitat OPH à Meudon et Chaville,fns,cmp2006,attribution,initial,Hauts-de-Seine Habitat - OPH,92532,Levallois-Perret Cedex,"[('2020-04-02', 'S3M (SERRURERIE - MENUISERIE METALLIQUE ET METALLERIE)', (149212, 'EUR'), None)]",['Ravalement'],[299],non,non
396,20-51391,2020-04-10,2020-06-10,['92'],"MARCHE DE TRAVAUX DE REHABILITATION THERMIQUE D'UNE RESIDENCE DE 73 LOGEMENTS Sis 22,30,32 rue des Cailloux 92110 CLICHY",fns,cmp2006,attribution,initial,Hauts-de-Seine Habitat - OPH,92532,Levallois Perret Cedex,"[('2020-03-26', 'DAS RAVALEMENT', (786579, 'EUR'), None), ('2020-03-26', 'MPO FENETRES', (271137, 'EUR'), None), ('2020-03-26', 'CIEL ETANCHE', (110967, 'EUR'), None), ('2020-03-26', 'BBM RENOV BAT', (194990, 'EUR'), None), ('2020-03-26', 'J. LIEVOUX', (48600, 'EUR'), None)]","['Etanchéité', 'Menuiserie', 'Ravalement', 'Ventilation']","[117, 222, 299, 360]",non,non
397,20-50457,2020-04-10,2020-06-08,['92'],Prestations de géomètres experts sur le patrimoine de hauts de Seine Habitat (2 lots),joue,autre,rectificatif,rectificatif,Hauts-de-Seine Habitat - OPH,92532,Levallois Perret,,['Topographie'],[344],non,non
398,20-51446,2020-04-10,2020-06-10,['92'],"Marché de travaux de construction de 29 logements locatifs sociaux et deux niveaux de parking en sous-sol, COLOMBES Zac de la Marine - Ilot K2a. Relance lot 3- Menuiseries Extérieures/Serrurerie",fns,cmp2006,attribution,initial,Hauts-de-Seine Habitat - OPH,92532,Levallois-Perret Cedex,"[('2020-03-23', 'ESTRADE', (393834, 'EUR'), None)]",['Menuiserie'],[222],non,non
399,20-51526,2020-04-10,2020-05-04,['92'],Le présent accord-cadre a pour objet l'achat et la livraison de fourniture de bureau ; l'achat et la livraison de consommables informatiques pour divers matériel dont le matériel d'impr,fns,cmp2006,appeloffre,initial,PARIS LA DEFENSE,92931,Paris la défense,,"['Consommables informatiques', 'Papeterie']","[68, 262]",non,non
400,20-51433,2020-04-10,2020-06-15,['93'],GESTION DELEGUEE DU STUDIO D'ENREGISTREMENT DE MUSIQUE DE L'EPIC BOBIGNY MUSIQUES 93,dsp,dsp,appeloffre,initial,BOBIGNY MUSIQUES 93,93000,BOBIGNY,,"['Equipements spécialisés', 'Délégation de service public']","[115, 406]",non,non
401,20-51501,2020-04-10,2020-06-01,['93'],Conseil et création communication marque Sécurité sociale.,fns,cmp2006,appeloffre,initial,UCANSS,93100,Montreuil,,"['Publicité, Communication']",[285],non,non
402,20-50333,2020-04-10,2020-05-15,['93'],mise à disposition d'une solution en mod saas d'un outil de gestion prévisionnelle des emplois et des compétences et prestations associées (rectificatif),joue,autre,rectificatif,rectificatif,ACOSS,93100,Montreuil,,"['Informatique (prestations de services)', 'Logiciel', 'Informatique (maintenance serveurs et réseaux)']","[163, 186, 454]",non,non
403,20-50276,2020-04-10,2020-05-13,['93'],TRAVAUX D'IMPRESSION DE SUPPORTS D'INFORMATION ET DE COMMUNICATION,joue,directive24,appeloffre,initial,COMMUNE DE BONDY,93143,Bondy cedex,,['Impression'],[160],oui,oui
404,20-50528,2020-04-10,2020-06-30,['93'],Tierce Maintenance Applicative du Système d'Information MEDOC et des applications associées,joue,directive24,attribution,initial,Direction Générale Finances Publiques,93186,Montreuil cedex,,['Informatique (prestations de services)'],[163],oui,non
405,20-50245,2020-04-10,2020-06-17,['93'],Tierce maintenance applicative de l'ERP Qualiac de la Société du Grand Paris.,joue,directive25,attribution,initial,Société du Grand Paris,93200,Saint denis,,['Informatique (maintenance serveurs et réseaux)'],[454],non,non
406,20-50347,2020-04-10,2020-06-09,"['93', '75', '91', '92', '94', '95', '77', '78']",Prestations d'accueil bâtimentaire sur le site du Campus Condorcet,joue,directive24,appeloffre,initial,Campus Condorcet,93322,Aubervilliers cedex,,['Prestations de services'],[274],non,non
407,20-51585,2020-04-10,2020-05-11,"['93', '75']",Marché pour l'élaboration du Schéma Directeur Technique de l'EPS Ville-Evrard et de prestations annexes dans le cadre de la reconversion de son site de Neuilly-sur-Marne dans le cadre de la,fns,cmp2006,appeloffre,initial,ETS PUBLIC DE SANTE DE VILLE EVRARD,93332,Neuilly sur marne,,"[""Assistance à maîtrise d'ouvrage""]",[433],non,non
408,20-50452,2020-04-10,2020-06-15,['93'],"Assistance technique relatif à la gestion et à l'entretien de la cuisine centrale et des office et à la fourniture, la production et la livraison et service des repas",joue,directive25,appeloffre,initial,SIVU CMRD,93370,Montfermeil,,['Restauration collective'],[66],non,non
