a00_cle_idweb,g04_01_date_publication,g04_03_date_fin_diffusion,g04_07_dep_publication,g04_09_resume_objet,g01_02_01_famille,g01_02_02_perimetre,g01_02_03_nature,g01_02_04_statut,d01_01_denomination,d01_07_cp,d01_08_ville,d08_09_decision_titulaireandRENSEIGNEMENT,g04_052_descripteurs_libelles,g04_051_descripteurs_codes,g04_061_criteres_sociaux,g04_062_criteres_environnementaux
20-86756,2020-07-07,2020-09-04,['2'],Transformation de plateau de bureau en maison médicale à Fère en Tardenois,fns,cmp2006,attribution,initial,SEDA,02007,Laon cédex,,"['Menuiserie', 'Peinture (travaux)', 'Plomberie (travaux)', 'Revêtements de sols', 'Serrurerie']","[222, 264, 270, 308, 321]",non,non
20-86848,2020-07-07,2020-08-21,['2'],Fourniture de couvre-sondes à usage unique avec mise à disposition de thermomètres professionnels et leurs accessoires pour les établissements membres du GHT SAPHIR,mapa,cmp2006,appeloffre,initial,CENTRE HOSPITALIER GENERAL DE SOISSONS,02209,Soissons,,['Consommables médicaux'],[69],non,non
20-86814,2020-07-07,2020-08-31,['5'],"MARCHE DE SERVICES POUR LE BROYAGE, L'EVACUATION ET LE TRAITEMENT DES DECHETS VERTS ET DU BOIS A ET B",fns,cmp2006,appeloffre,initial,Cté Cnes Serre-Poncon Val d'Avance,05230,La Bâtie Neuve,,['Déchetterie (exploitation)'],[405],non,non
20-87259,2020-07-07,2020-07-31,['6'],"MAPA 2020-034 : CONTRÔLES PERIODIQUES REGLEMENTAIRES DES BÂTIMENTS DE LA VILLE, DU CCAS ET DU GIP",fns,cmp2006,appeloffre,initial,COMMUNE LE CANNET,06110,Le Cannet,,"['Ascenseur', 'Contrôle technique', 'Gaz divers']","[17, 72, 139]",non,non
20-87340,2020-07-07,2020-07-27,['6'],MAPA 2020-055- Maintenance des systèmes d'horlogerie et des sonneries de cours de la ville du Cannet,mapa,cmp2006,appeloffre,initial,COMMUNE LE CANNET,06110,Le Cannet,,['Maintenance'],[196],non,non
20-87059,2020-07-07,2020-07-27,"['6', '75', '83', '13']",Prestations de services d'assurances,fns,cmp2006,appeloffre,initial,SICASIL,06150,cannes la Bocca,,"['Assurance', 'Assistance juridique']","[20, 434]",non,non
20-87075,2020-07-07,2020-09-07,['6'],MAINTENANCE DU PROGICIEL PELEHAS DE GESTION DES DEMANDES DE LOGEMENT,fns,cmp2006,attribution,initial,METROPOLE NCA,06364,NICE CEDEX 4,,['Informatique (prestations de services)'],[163],non,non
20-87272,2020-07-07,2020-09-07,['6'],19N0631 - Maintenance et évolutions du logiciel SALAMANDRE de gestion de la cuisine centrale dans le cadre de la restauration scolaire ainsi que ses modules associés et prestations associées.,fns,cmp2006,attribution,initial,METROPOLE NCA,06364,NICE CEDEX 4,"[('2020-07-02', 'Entreprise SALAMANDRE', (25829, 'EUR'), None)]","['Logiciel', 'Maintenance']","[186, 196]",non,non
20-85461,2020-07-07,2020-07-27,['6'],"mise à disposition, installation, entretien et exploitation de mobiliers urbains publicitaires et non publicitaires sur le domaine public de la commune de mouans-sartoux.",dsp,dsp,appeloffre,initial,Ville de Mouans-Sartoux,06370,Mouans-Sartoux,,['Mobilier urbain'],[231],non,oui
20-87211,2020-07-07,2020-08-07,['6'],Création d'un Ossuaire - Cimetière de l'Abadie Annexe - Cannes,fns,cmp2006,appeloffre,initial,COMMUNE DE CANNES,06406,CANNES,,"['Bâtiment', 'Cimetière']","[33, 437]",non,non
20-87316,2020-07-07,2020-08-06,['6'],"Travaux de rénovation, de mise en conformité et maintenance des installations électriques des bâtiments communaux",fns,cmp2006,appeloffre,initial,Ville de Carros,06512,Carros Cedex,,['Electricité (travaux)'],[105],non,non
20-87039,2020-07-07,2020-08-01,['6'],"LOCATION ET INSTALLATION DE MATERIELS SON, LUMIERE ET STRUCTURES DE SCENE, AVEC OU SANS MISE A DISPOSITION DE PERSONNELS TECHNIQUES",fns,cmp2006,appeloffre,initial,COMMUNE DE PEYMEINADE,06530,Peymeinade,,"['Matériel scénique', 'Sonorisation']","[216, 324]",non,non
20-87309,2020-07-07,2020-09-02,['7'],Fourniture et pose des installations de rafraichissement à détente directe dans divers bâtiments départementaux.,fns,cmp2006,attribution,initial,Département de l'Ardèche,07000,Privas,"[('2020-05-25', 'ALTECI ENERGIE', (8362, 'EUR'), None), ('2020-05-25', 'ALTECI ENERGIE', (7878, 'EUR'), None), ('2020-05-25', 'Martial JACOUTON', (7105, 'EUR'), None), ('2020-05-25', 'Martial Jacouton', (8432, 'EUR'), None), ('2020-05-25', 'SANIPAC', (25500, 'EUR'), None), ('2020-05-25', 'Largier technologie', (6800.38, 'EUR'), None), ('2020-05-25', 'Largier technologie', (25599, 'EUR'), None), ('2020-05-25', 'Axima réfrigération', (27900, 'EUR'), None)]",['Climatisation'],[62],non,non
20-87320,2020-07-07,2020-07-31,['7'],Travaux passerelle Marc Seguin,fns,cmp2006,attribution,initial,Département de l'Ardèche,07007,Privas,"[('2020-06-09', 'Lassarat', (228172.0, 'EUR'), None)]",['Passerelle'],[286],non,non
20-86962,2020-07-07,2020-07-15,['7'],Produits contre l'incontinence pour l'EHPAD le Méridien à Ruoms (07).,mapa,cmp2006,appeloffre,initial,EHPAD LE MERIDIEN,07120,RUOMS,,['Hygiène (articles)'],[153],non,non
20-87178,2020-07-07,2020-08-04,['8'],Assurance dommage ouvrage pour l'opération : Reconstruction du service de stérilisation centrale du Centre Hospitalier Intercommunal nord Ardennes,mapa,cmp2006,appeloffre,initial,CTRE HOSP INTERCOMMUNAL NORD ARDENNES,08011,Charleville Mézières cedex,,['Assurance'],[20],non,non
20-87035,2020-07-07,2020-07-28,['8'],"Mission de coordination, de sécurité et de protection de la santé concernant la réalisation de la voie verte Sud-Ardennes-.",mapa,cmp2006,appeloffre,initial,Conseil Départemental des Ardennes,08011,CHARLEVILLE MEZIERES cedex,,"[""Mission d'ordonnancement, pilotage, coordination (OPC)""]",[234],non,non
20-76016,2020-07-07,2020-08-26,['10'],Confection et livraison de repas en liaison froide pour les personnes âgées autonomes à la MARPA ESTISSAC,fns,cmp2006,appeloffre,initial,Troyes Champagne Métropole,10000,Troyes,,"['Repas, traiteur']",[304],non,non
20-87046,2020-07-07,2020-08-06,['10'],"Fourniture de Dispositifs Médicaux Stériles au GHT Aube et sézannais, du 01/07/20 au 30/06/23.",fns,cmp2006,attribution,initial,Centre hospitalier de Troyes,10003,Troyes cedex,"[('2020-07-01', 'ABBOTT DIABETES CARE', (37850.1, 'EUR'), None), ('2020-07-01', 'ABBOTT MEDICAL FRANCE SAS', (570925, 'EUR'), None), ('2020-07-01', 'ALBYN MEDICAL', (27977.4, 'EUR'), None), ('2020-07-01', 'ALCON', (8943.6, 'EUR'), None), ('2020-07-01', 'AMBU SARL', (29550, 'EUR'), None), ('2020-07-01', 'AMO FRANCE SAS', (12600, 'EUR'), None), ('2020-07-01', 'API 2000', (11595, 'EUR'), None), ('2020-07-01', 'AQUA TOOLS', (204330, 'EUR'), None), ('2020-07-01', 'ARTHREX FRANCE', (37779, 'EUR'), None), ('2020-07-01', 'ASAHI INTECC CO. LTD', (142620, 'EUR'), None), ('2020-07-01', 'ASEPT INMED SAS', (10626.42, 'EUR'), None), ('2020-07-01', 'AVANOS MEDICAL FRANCE', (24030, 'EUR'), None), ('2020-07-01', 'B. BRAUN MEDICAL', (55613.7, 'EUR'), None), ('2020-07-01', 'BARD FRANCE SAS', (177735, 'EUR'), None), ('2020-07-01', 'BAUSCH & LOMB FRANCE', (3600, 'EUR'), None), ('2020-07-01', 'BECTON DICKINSON FRANCE', (3510, 'EUR'), None), ('2020-07-01', 'BIOSYNEX', (1890, 'EUR'), None), ('2020-07-01', 'BIOTRONIK FRANCE', (9250, 'EUR'), None), ('2020-07-01', 'BOSTON SCIENTIFIC SAS', (375538, 'EUR'), None), ('2020-07-01', 'CAIR LGL', (43913.4, 'EUR'), None), ('2020-07-01', 'CARDINAL HEALTH FRANCE 506', (15126, 'EUR'), None), ('2020-07-01', 'CARELIDE', (1368, 'EUR'), None), ('2020-07-01', 'CCD', (1365, 'EUR'), None), ('2020-07-01', 'CG MEDICAL', (3832.5, 'EUR'), None), ('2020-07-01', 'CLINICAL IHT', (26752.35, 'EUR'), None), ('2020-07-01', 'CODAN FRANCE', (423625.2, 'EUR'), None), ('2020-07-01', 'COLOPLAST', (70507.5, 'EUR'), None), ('2020-07-01', 'COMEPA INDUSTRIES', (22692, 'EUR'), None), ('2020-07-01', 'COOK FRANCE', (51742, 'EUR'), None), ('2020-07-01', 'CORMEDICA SAS', (11730, 'EUR'), None), ('2020-07-01', 'CRISTALENS SA', (924, 'EUR'), None), ('2020-07-01', 'DIDACTIC', (1548, 'EUR'), None), ('2020-07-01', 'DORAN INTERNATIONAL', (17508, 'EUR'), None), ('2020-07-01', 'EDWARDS LIFESCIENCES SAS', (69477, 'EUR'), None), ('2020-07-01', 'ELITECH MICROBIO', (8452.05, 'EUR'), None), ('2020-07-01', 'ERBE MEDICAL', (35432.1, 'EUR'), None), ('2020-07-01', 'EURO DIFFUSION MEDICALE', (6435.3, 'EUR'), None), ('2020-07-01', 'EUROMEDIS', (3201, 'EUR'), None), ('2020-07-01', 'GAMIDA', (4500, 'EUR'), None), ('2020-07-01', 'GETINGE FRANCE', (31032, 'EUR'), None), ('2020-07-01', 'GLAXOSMITHKLINE', (1379.4, 'EUR'), None), ('2020-07-01', 'GROUPE SERVIBIO', (27210, 'EUR'), None), ('2020-07-01', 'HEXACATH FRANCE', (29250, 'EUR'), None), ('2020-07-01', 'HOLOGIC FRANCE', (27000, 'EUR'), None), ('2020-07-01', 'HOLTEC', (12658.5, 'EUR'), None), ('2020-07-01', 'ICU MEDICAL FRANCE', (11835, 'EUR'), None), ('2020-07-01', 'IMMED EUROPE', (42424.32, 'EUR'), None), ('2020-07-01', 'INTERSURGICAL', (14680.5, 'EUR'), None), ('2020-07-01', 'JOHNSON & JOHNSON MEDICAL SAS', (528964.07, 'EUR'), None), ('2020-07-01', 'KARL STORZ ENDOSCOPIE FRANCE', (9660, 'EUR'), None), ('2020-07-01', 'KOMET FRANCE', (847.28, 'EUR'), None), ('2020-07-01', 'LCH MEDICAL PRODUCTS', (1540.98, 'EUR'), None), ('2020-07-01', 'LEMAITRE VASCULAR', (2970, 'EUR'), None), ('2020-07-01', 'MASIMO EUROPE LIMITED', (93717, 'EUR'), None), ('2020-07-01', 'MEDICAL MEASUREMENT SYSTEMS BV (LABORIE MEDICAL)', (1350, 'EUR'), None), ('2020-07-01', 'MEDLINE INTERNATIONAL FRANCE SAS', (8649.45, 'EUR'), None), ('2020-07-01', 'MEDTRONIC FRANCE SAS', (250121.4, 'EUR'), None), ('2020-07-01', 'MERIT MEDICAL', (153423, 'EUR'), None), ('2020-07-01', 'MORIA SA', (1356, 'EUR'), None), ('2020-07-01', 'MVF DISPOSABLES', (1169.78, 'EUR'), None), ('2020-07-01', 'NAL VON MINDEN', (21000, 'EUR'), None), ('2020-07-01', 'OLYMPUS FRANCE', (27638.89, 'EUR'), None), ('2020-07-01', 'ORBUS INTERNATIONAL BV', (106200, 'EUR'), None), ('2020-07-01', 'OWEN MUMFORD', (826.5, 'EUR'), None), ('2020-07-01', 'PETERS SURGICAL', (18303.84, 'EUR'), None), ('2020-07-01', 'POURET MEDICAL', (1282.2, 'EUR'), None), ('2020-07-01', 'PRODIMED', (19595.7, 'EUR'), None), ('2020-07-01', 'RAFFIN MEDICAL', (8083.22, 'EUR'), None), ('2020-07-01', 'ROCHE DIABETES CARE FRANCE', (276644.4, 'EUR'), None), ('2020-07-01', 'SANTELEC', (337.5, 'EUR'), None), ('2020-07-01', 'SLB MEDICAL', (1540.5, 'EUR'), None), ('2020-07-01', 'SMITHS MEDICAL FRANCE SA', (218413.98, 'EUR'), None), ('2020-07-01', 'SNVL VARAY LABORIX', (1899, 'EUR'), None), ('2020-07-01', 'SWANN MORTON / SINNER', (6318, 'EUR'), None), ('2020-07-01', 'TELEFLEX MEDICAL SAS', (157025.1, 'EUR'), None), ('2020-07-01', 'TELIC FRANCE SAS', (3174, 'EUR'), None), ('2020-07-01', 'TERUMO FRANCE SAS', (314280, 'EUR'), None), ('2020-07-01', 'TETRA MEDICAL', (5832, 'EUR'), None), ('2020-07-01', 'THE SURGICAL COMPANY', (76131, 'EUR'), None), ('2020-07-01', 'THIEBAUD SAS', (4095, 'EUR'), None), ('2020-07-01', 'VYGON SA', (122625.71, 'EUR'), None), ('2020-07-01', 'W.L. GORE & ASSOCIES SARL', (4398.35, 'EUR'), None), ('2020-07-01', 'ZIMMER BIOMET FRANCE', (2205, 'EUR'), None)]",['Matériel médical'],[212],oui,oui
20-86726,2020-07-07,2020-08-17,['11'],ETUDE ARCHEOLOGIQUE DU BATI DU PALAIS DES ARCHEVEQUES,fns,cmp2006,appeloffre,initial,COMMUNE DE NARBONNE,11108,NARBONNE CEDEX,,"['Etude', 'Monuments historiques', 'Fouille archéologique']","[118, 236, 450]",non,non
20-86794,2020-07-07,2020-08-05,['11'],Démolition de la piscine municipale de Trèbes,fns,cmp2006,appeloffre,initial,ville de Trèbes,11800,Trèbes,,"['Démolition', 'Piscine', 'Amiante (désamiantage)']","[87, 265, 479]",non,non
20-86974,2020-07-07,2020-08-07,['11'],"Fournitures et pose de panneaux signalétiques sur des sites de sport de nature, d'espaces naturels sensibles et sur les propriétés départementales",fns,cmp2006,attribution,initial,Département de l'Aude,11855,CARCASSONNE Cedex 9,,"['Panneaux', 'Signalisation']","[261, 322]",non,non
20-86850,2020-07-07,2020-09-07,['11'],TRAVAUX DIVERS DE PLATRERIE ET DE PLOMBERIE POUR LE SDIS DE L AUDE ET LES CENTRES DE SECOURS DE L'AUDE,fns,cmp2006,attribution,initial,SDIS DE L'AUDE,11870,Carcassonne cedex 9,"[('2020-07-06', 'PERIES ET FILS', (150000, 'EUR'), None), ('2020-07-06', 'FABIEN BARROT', (100000, 'EUR'), None), ('2020-07-06', 'SARL RAYNIER', (350000, 'EUR'), None), ('2020-07-06', 'SARL RAYNIER', (250000, 'EUR'), None)]","['Plâtrerie', 'Plomberie (travaux)']","[269, 270]",non,non
20-87080,2020-07-07,2020-09-07,['12'],rd 510 groupement de commandes - opération de sécurité 'déviation de la besse' et elargissement du ch. rural du cimetière à la monpélieyre - commune de villefranche de panat,fns,cmp2006,attribution,initial,Conseil Départemental de l AVEYRON,12450,Flavin,"[('2020-07-06', 'SAS GDTP', (249811, 'EUR'), None)]",['Voirie'],[365],non,non
20-87076,2020-07-07,2020-07-30,['13'],désignation titulaire de marché de travaux pour le remplacement système cvc et une partie de l'étanchéité de la toiture du bâtiment de la drfip paca bdr 52 rue liandier 13008,fns,cmp2006,appeloffre,initial,DGFIP,13008,MARSEILLE,,"['Chauffage (travaux)', 'Climatisation', 'Etanchéité']","[61, 62, 117]",non,non
20-87289,2020-07-07,2020-08-27,['13'],PRESTATIONS DE TIERCE MAINTENANCE APPLICATIVE EVOLUTIVES RELATIVES A LA SUITE LOGICIELLE SALESFORCE,fns,cmp2006,appeloffre,initial,Régie des Transports Métropolitains,13013,Marseille,,['Informatique (prestations de services)'],[163],non,non
20-87118,2020-07-07,2020-07-31,['13'],Numéro de la consultation : 2020-04 Réfection du bâtiment de la future Police Municipale,fns,cmp2006,appeloffre,initial,COMMUNE DE SIMIANE COLLONGUE,13109,SIMIANE-COLLONGUE,,"['Fondations spéciales', 'Gros oeuvre']","[129, 144]",non,non
20-87176,2020-07-07,2020-09-10,"['13', '30']",fourniture et réalisation d'équipements de mesures environnementales de température et de pression afin d'alimenter le système de surveillance par fibre optique,mapa,cmp2006,appeloffre,initial,SYMADREM (syndicat aménagement digues),13200,Arles,,"['Fibre optique', 'Matériel électrique']","[133, 203]",non,non
20-87078,2020-07-07,2020-09-10,"['13', '30']",FOURNITURE ET INSTALLATION D'EQUIPEMENTS DE MESURES ENVIRONNEMENTALES ET D'UNE ALIMENTATION DE SECOURS AU SYSTEME D'ACQUISITION FIBRE OPTIQUE,mapa,cmp2006,appeloffre,initial,SYMADREM (syndicat aménagement digues),13200,Arles,,"['Fibre optique', 'Matériel électrique']","[133, 203]",non,non
20-87295,2020-07-07,2020-07-29,['13'],"Fourniture, pose et maintenance de portes automatiques et portails",mapa,cmp2006,appeloffre,initial,GRAND PORT MARITIME DE MARSEILLE,13226,MARSEILLE,,"['Porte automatique, portail']",[412],non,non
20-87143,2020-07-07,2020-07-21,['83'],REMPLACEMENT DE BATIMENTS MODULAIRES SUR LES SITES DES CFAR DES ARCS ET DU BEAUSSET DE LA CMAR PACA,fns,cmp2006,attribution,initial,CMAR PACA,13295,Marseille Cedex 8,"[('2020-07-06', 'SAS SOCOMA', (166544, 'EUR'), None), ('2020-06-29', 'ALGECO', (417310, 'EUR'), None), ('2020-06-29', 'SPIE BATIGNOLLES ENERGIE GRAND SUD', (9702, 'EUR'), None), ('2020-07-06', 'SAS SOCOMA', (137859, 'EUR'), None), ('2020-06-29', 'ALGECO', (325380, 'EUR'), None), ('2020-06-29', 'SPIE BATIGNOLLES ENERGIE GRAND SUD', (13563, 'EUR'), None), ('2020-06-29', 'VALGO SUD', (28380, 'EUR'), None)]","['Bâtiments modulaires', 'Démolition', 'Electricité (travaux)', 'Gros oeuvre']","[27, 87, 105, 144]",non,non
20-87350,2020-07-07,2020-08-03,['13'],Mission d'assistance technique pour le suivi des travaux liés à la délégation de Service Public à la VILLA MEDITERRANEE,fns,cmp2006,appeloffre,initial,Conseil Rég Provence-Alpes-Côte d'Azur,13331,Marseille,,['Assistance technique'],[19],non,non
20-87353,2020-07-07,2020-07-30,['13'],"Remplacement des menuiseries extérieures bâtiments C, D et E au lycée A. ARTAUD à Marseille (13)",fns,cmp2006,appeloffre,initial,Conseil Rég Provence-Alpes-Côte d'Azur,13331,Marseille,,"['Menuiserie', 'Amiante (désamiantage)']","[222, 479]",non,non
20-86942,2020-07-07,2020-08-03,['13'],20FCS18 ACQUISITION DE 3 VEHICULES CHASSIS DOUBLE CABINE,fns,cmp2006,appeloffre,initial,COMMUNE DE PORT DE BOUC,13528,Port de Bouc Cédex,,['Véhicules (acquisition)'],[475],non,non
20-87098,2020-07-07,2020-08-17,"['13', '84']","La fourniture de produits de boulangerie fraîche pour les sites du Crous d'Avignon- pains boules ou serviettes 50grammes- pains frais pour sandwich : lageur 7 à 8 cm, longueur 28 cmLe pain doi",fns,cmp2006,appeloffre,initial,CENTRE REGIONAL OEUVRES UNIV SCOLAIRES,13621,Aix en provence,,['Denrées alimentaires'],[88],non,non
20-87370,2020-07-07,2020-07-23,['13'],La présente consultation est un accord-cadre de services relatif à l'exécution de prestations d'hébergement en secteur hôtelier privé.,fns,cmp2006,appeloffre,rectificatif,ECOLE DE L AIR,13661,Salon air,,['Prestation hotelière'],[466],oui,oui
20-86937,2020-07-07,2020-08-06,['13'],Numéro de la consultation : 2020-S-0025 MARTIGUES - ISOLATION THERMIQUE DES COMBLES DE 5 BATIMENTS COMMUNAUX - MAITRISE D'OEUVRE,fns,cmp2006,appeloffre,initial,COMMUNE DE MARTIGUES,13692,Martigues cedex,,"[""Maîtrise d'oeuvre""]",[197],non,non
20-87306,2020-07-07,2020-08-07,['13'],Numéro de la consultation : 2020-0460 Aménagement VRD du Centre Hospitalier d'Allauch,fns,cmp2006,appeloffre,initial,GHT / Centre Hospitalier d'Allauch,13718,ALLAUCH,,['Voirie et réseaux divers'],[366],non,non
20-87240,2020-07-07,2020-10-04,['13'],Numéro de la consultation : 2020/FCS/0010 Fourniture de mobilier scolaire et de restauration,fns,cmp2006,attribution,initial,COMMUNE LES PENNES MIRABEAU,13758,LES PENNES MIRABEAU,"[('2020-07-07', 'SAS', (40000, 'EUR'), None), ('2020-07-07', 'SAS', (30000, 'EUR'), None)]",['Mobilier'],[230],non,non
20-86887,2020-07-07,2020-10-04,['13'],Numéro de la consultation : 2019/FCS/0064 Service d'entretien du patrimoine arboré,fns,cmp2006,attribution,initial,COMMUNE LES PENNES MIRABEAU,13758,LES PENNES MIRABEAU,"[('2020-05-05', 'sarl arboriste du sud', (66000, 'EUR'), None)]","['Prestations de services', 'Végétaux']","[274, 358]",non,non
20-87314,2020-07-07,2020-10-04,['13'],Numéro de la consultation : 2020/FCS/0019 Fourniture de matériels didactiques,fns,cmp2006,attribution,initial,COMMUNE LES PENNES MIRABEAU,13758,LES PENNES MIRABEAU,"[('2020-07-07', 'CHARLEMAGNE', (24000, 'EUR'), None)]",['Matériel didactique'],[202],non,non
20-87023,2020-07-07,2020-10-04,['13'],Numéro de la consultation : 2020/FCS/0011 Fourniture d'habillement et d'accessoires pour les agents de la police municipale et les ASVP,fns,cmp2006,attribution,initial,COMMUNE LES PENNES MIRABEAU,13758,LES PENNES MIRABEAU,"[('2020-07-07', 'SENTINEL', (28000, 'EUR'), None), ('2020-07-07', 'SENTINEL', (8000, 'EUR'), None)]",['Habillement'],[150],non,non
20-86847,2020-07-07,2020-09-04,"['14', '27', '50', '61', '76']",Construction d'une fumière et d'un bâtiment de stockage de fourrage au Centre équestre de la Ville de Caen,fns,cmp2006,appeloffre,initial,Ville de Caen,14027,CAEN,,['Bâtiment'],[33],non,non
20-87246,2020-07-07,2020-08-25,['14'],Assistance à maîtrise d'ouvrage pour la définition et la mise en place d'un suivi-évaluation du SRADDET de la Région Normandie,fns,cmp2006,appeloffre,initial,Région Normandie,14035,CAEN,,"['Etude', ""Assistance à maîtrise d'ouvrage""]","[118, 433]",non,non
20-87081,2020-07-07,2020-09-07,['15'],Travaux d'installation de garde corps à la déchetterie des 4 chemins,mapa,cmp2006,attribution,initial,Communauté d'Agglomération du Bassin,15005,AURILLAC CEDEX,,"['Déchetterie (travaux)', 'Matériel de sécurité']","[96, 209]",non,non
20-87201,2020-07-07,2020-07-30,['16'],Déconstruction de l'installation de distribution de carburants de Saint-Martin,fns,cmp2006,appeloffre,initial,Commune d'Angoulême,16022,Angoulême cedex,,['Démolition'],[87],non,non
20-87203,2020-07-07,2020-08-14,['16'],"Révision du schéma de cohérence territoriale de l'Angoumois, enrichissement de la trame verte et bleue.",fns,cmp2006,appeloffre,initial,GrandAngoulême agglomération,16023,Angoulême cedex,,['Etude'],[118],non,non
20-87351,2020-07-07,2020-08-28,['17'],Mise en conformité du bâtiment 'Assistance à la pêche' sur le Port de pêche de Chef de Baie à La Rochelle,fns,cmp2006,appeloffre,initial,SYNDICAT MIXTE PORT CHEF DE BAIE,17000,LA ROCHELLE,,"['Electricité (travaux)', 'Plomberie (travaux)', 'Ventilation']","[105, 270, 360]",non,non
20-87253,2020-07-07,2020-08-05,['17'],"Construction d'une gendarmerie à SAINT-PIERRE D'OLERON (17310) comprenant une zone ''service et technique'' composée d'une entité bureaux et espaces associés, et d&a",fns,cmp2006,appeloffre,initial,Semdas,17076,La rochelle cedex 9,,['Bâtiment'],[33],non,non
20-38327,2020-07-07,2020-08-10,['17'],"fourniture, pose et entretien des bornes en pierre du chemin de saint jacques de compostelle",mapa,cmp2006,appeloffre,initial,Cons. Départ. de la Charente-Maritime,17076,La Rochelle Cedex 9,,['Travaux de viabilité'],[353],non,non
20-87217,2020-07-07,2020-08-18,['17'],Numéro de la consultation : 2020.TX.SAC.0111 ESPACE VIEUX PORT AMENAGEMENT DU QUAI DUPERRE TRAVAUX DE VRD,fns,cmp2006,appeloffre,initial,VILLE LA ROCHELLE,17086,La Rochelle,,['Voirie et réseaux divers'],[366],non,non
20-87301,2020-07-07,2020-09-21,['17'],MAINTENANCE DES ASCENSEURS ET MONTE CHARGES DES BATIMENTS DE LA COMMUNAUTE D'AGGLOMERATION DE LA ROCHELLE,mapa,cmp2006,appeloffre,initial,CDA LA ROCHELLE,17086,La Rochelle,,"['Ascenseur', 'Maintenance']","[17, 196]",non,non
20-87337,2020-07-07,2020-08-06,['17'],Mission OPC pour la construction d'un pôle tertiaire à Royan accueillant le siège de la CARA et la maison des entreprises,mapa,cmp2006,appeloffre,initial,Agglomération Royan Atlantique,17200,Royan,,"[""Mission d'ordonnancement, pilotage, coordination (OPC)""]",[234],non,non
20-87338,2020-07-07,2020-08-07,"['40', '64', '33', '47', '32', '65']",Travaux de rétablissement de la continuité écologique du Pont du Gouvernement à Sainte Eulalie (40),fns,cmp2006,appeloffre,initial,Conservatoire du littoral,17306,Rochefort cedex,,['Voirie et réseaux divers'],[366],non,non
20-87154,2020-07-07,2020-07-30,['18'],CREATION D'UN LOCAL DE STOCKAGE EN REZ DE JARDIN DE 120M² AU CENTRE HOSPITALIER JACQUES DE BOURGES,fns,cmp2006,appeloffre,initial,C.H. Jacques Coeur de Bourges,18020,BOURGES cedex,,"['Electricité (travaux)', 'Gros oeuvre', 'Plâtrerie', 'Plomberie (travaux)', 'Serrurerie']","[105, 144, 269, 270, 321]",non,non
20-86981,2020-07-07,2020-08-10,['19'],fourniture d'articles de bureau et de consommables informatiques,fns,cmp2006,appeloffre,initial,I.F.C.E.,19230,Arnac-Pompadour,,"['Articles de bureau et articles scolaires', 'Consommables informatiques']","[16, 68]",non,non
20-86934,2020-07-07,2020-08-10,['20A'],Aménagement des espaces extérieurs de la salle des fêtes communale,fns,cmp2006,appeloffre,initial,COMMUNE DE CARGESE,20130,Cargèse,,['Maçonnerie'],[195],non,non
20-87109,2020-07-07,2020-08-10,['20B'],Etudes préliminaires détaillées sur le réseau ferroviaire de Corse : infrastructure tram train section gare de Bastia/port de Toga et création d'une nouvelle halte dans le tunnel de Toretta au dr,fns,cmp2006,appeloffre,initial,COLLECTIVITE DE CORSE,20187,AJACCIO,,"['Etude', 'Voies ferrées']","[118, 364]",non,non
20-87238,2020-07-07,2020-10-04,['20A'],Numéro de la consultation : AV19/096 Carnaval de la Ville d'Ajaccio 2020 - Réalisation et maintenance d'un décor de char et location d'une plateforme autotractée avec chauffeur,fns,cmp2006,attribution,initial,COMMUNE D AJACCIO,20304,Ajaccio,[],['Location (matériels)'],[185],non,non
20-86727,2020-07-07,2020-09-02,['21'],Fourniture et livraison des titres-restaurant de l'Opéra de Dijon,fns,cmp2006,appeloffre,initial,Opéra de Dijon,21000,Dijon,,['Titres restaurant'],[416],non,oui
20-87058,2020-07-07,2020-08-06,['21'],etude de faisabilité d'une unité de méthanisation sur le territoire de la commune d'epoisses et alentours,mapa,cmp2006,attribution,initial,SICECO,21074,Dijon cédex,,['Etude'],[118],non,non
20-86882,2020-07-07,2020-09-30,['21'],desamiantage et curage urgences pediatriques hopital d'enfants chu dijon bourgogne,fns,cmp2006,attribution,initial,Centre Hospitalier Universitaire Dijon,21079,dijon cedex,"[('2020-07-07', 'Jobard Sarl', (166258.0, 'EUR'), None), ('2020-07-07', 'Devarennes Remédiation Sas', (79794.0, 'EUR'), None)]","['Démolition', 'Amiante (désamiantage)']","[87, 479]",non,non
20-86731,2020-07-07,2020-10-02,['22'],Numéro de la consultation : 2020-FCS-0020 Fourniture de produits et matériels d'entretien,fns,cmp2006,appeloffre,initial,SCE DEPARTEMENTAL INCENDIE ET SECOURS,22015,SAINT-BRIEUC,,"[""Produits d'entretien""]",[278],non,non
20-87300,2020-07-07,2020-09-02,['25'],"NETTOYAGE, TRI ET EVACUATION DE DECHETS DE DEUX GOUFFRES ET DEUX DOLINES SUR LE SITE 'ESPACE NATUREL SENSIBLE (ENS) DE LA TOURBIERE DES GUILLEMINS'",mapa,cmp2006,appeloffre,initial,DEPARTEMENT DU DOUBS,25031,BESANCON Cedex,,['Décharge'],[84],non,non
20-86832,2020-07-07,2020-07-22,"['21', '25', '70', '71', '89']",DESIGNATION D'UN COORDONNATEUR SPS DANS LE CADRE DE L'EXPLOITATION-MAINTENANCE DE RELAIS HERTZIENS ET DU DEPLOIEMENT THD RADIO DU RESEAU REGIONAL RCUBE THD ET DANS LE CADRE DE TRAVAUX D&apos,fns,cmp2006,appeloffre,initial,Région Bourgogne - Franche-Comté,25031,Besancon cedex,,['Assistance technique'],[19],non,non
20-86792,2020-07-07,2020-08-04,['25'],Grand Besançon Métropole - Source d'Arcier - Délimitation des zones les plus contributives de l'aire d'alimentation du captage et mise à jour du diagnostic de vulnérabilité,mapa,cmp2006,appeloffre,initial,GRAND BESANCON METROPOLE,25043,BESANCON,,"['Alimentation en eau potable', 'Captage', 'Etude']","[6, 51, 118]",non,non
20-72262,2020-07-07,2020-08-21,['25'],Etude géotechnique (G1) préalable à l'aménagement de la zae champs chevaux à saint-vit,mapa,cmp2006,appeloffre,initial,Grand Besançon Métropole,25043,Besancon,,['Etude'],[118],non,non
