a00_cle_idweb,g04_01_date_publication,g04_03_date_fin_diffusion,g04_07_dep_publication,g04_09_resume_objet,g01_02_01_famille,g01_02_02_perimetre,g01_02_03_nature,g01_02_04_statut,d01_01_denomination,d01_07_cp,d01_08_ville,d08_09_decision_titulaireandRENSEIGNEMENT,g04_052_descripteurs_libelles,g04_051_descripteurs_codes,g04_061_criteres_sociaux,g04_062_criteres_environnementaux
21-527,2021-01-07,2021-03-09,['30'],Accord-cadre de gardiennage et de surveillance lors d'évènements et des bâtiments et établissements municipaux,joue,directive24,attribution,initial,Ville de Nîmes,30947,Nimes,"[('2021-01-04', 'POWER PROTECTION ET SECURITE', (1691163, 'EUR'), ""Prestations de surveillance et de gardiennage lors d'évènements""), ('2020-12-22', 'PROTECTION SECURITE INDUSTRIE', (3957465, 'EUR'), 'Surveillance et gardiennage des bâtiments et établissements municipaux')]","['Gardiennage', 'Surveillance']","[138, 331]",non,non
21-1365,2021-01-07,2021-04-04,['31'],Nomination du commissaire aux comptes de Tisséo Ingénierie et de son suppléant,joue,directive24,attribution,initial,SOC DE LA MOBILITE DE AGGL TOULOUSAINE,31004,Toulouse,"[('2020-10-27', 'Cifralex', (157140, 'EUR'), None)]",['Expertise comptable'],[446],non,non
21-858,2021-01-07,2021-02-01,['31'],"Prestation techniques et fournitures relatives à la maintenance, l'entretien et l'optimisation des installations, de sécurité incendie et moyens de secours",joue,autre,rectificatif,rectificatif,CHU DE TOULOUSE,31059,Toulouse cedex 9,,"[""Assistance à maîtrise d'ouvrage""]",[433],non,non
21-1252,2021-01-07,2021-04-03,['31'],Fourniture de consommables pour blanchisserie et articles de mercerie,joue,directive24,appeloffre,initial,CHU DE TOULOUSE,31059,Toulouse cedex 9,,['Matériel de bureau'],[207],non,non
21-726,2021-01-07,2021-02-05,['31'],Fourniture d'imprimés avec façonnage,joue,directive24,appeloffre,initial,CHU DE TOULOUSE,31059,Toulouse cedex 9,,['Imprimés'],[161],non,non
21-1288,2021-01-07,2021-02-01,['31'],Prestations de services d'objets communiquant pour les moyens roulants de Tisseo,joue,directive25,appeloffre,initial,TISSEO,31081,Toulouse,,"['Télécommunications', 'Carte magnétique, carte à puce']","[338, 403]",non,non
21-1352,2021-01-07,2021-04-04,['31'],Transport et traitement des déchets ménagers (2 lots),joue,directive24,attribution,initial,CC DU BASSIN AUTERIVAIN HAUT GARONNAIS,31190,Auterive,"[('2020-11-16', 'Veolia Proprete Midi Pyrenees', (1023715, 'EUR'), ""transport et traitement des déchets d'ordures ménagères résiduelles""), ('2020-11-16', 'Paprec', (73281, 'EUR'), 'tri-conditionnement-reprise de la collecte sélective fibreuse')]","['Collecte sélective', 'Ordures ménagères (prestations)']","[82, 249]",non,non
21-1350,2021-01-07,2021-04-04,['31'],Groupement de commande pour la gestion et animation des structures enfance-jeunesse,joue,directive24,attribution,initial,CC DU BASSIN AUTERIVAIN HAUT GARONNAIS,31190,Auterive,"[('2020-11-30', 'Léo Lagrange Sud-Ouest', (538798.73, 'EUR'), 'Les Alae'), ('2020-11-30', 'Léo Lagrange Sud-Ouest', (341595.65, 'EUR'), 'Les Alsh'), ('2020-11-30', 'Léo Lagrange Sud-Ouest', (141127.57, 'EUR'), 'Jeunesse')]",['Prestations de services'],[274],non,non
21-1354,2021-01-07,2021-04-04,['31'],Souscription des contrats d'assurances pour la Communauté de Communes/relance suite à consultation initiale infructueuse sur 3 lots,joue,directive24,attribution,initial,CC DU BASSIN AUTERIVAIN HAUT GARONNAIS,31190,Auterive,"[('2020-11-16', 'Smacl', (17168.13, 'EUR'), 'dommage aux biens'), ('2020-11-16', 'Paris Nord Assurance', (8031.44, 'EUR'), 'responsabilités'), ('2020-11-16', 'Smacl', (25720.27, 'EUR'), 'véhicules à moteur')]",['Assurance'],[20],non,non
21-2403,2021-01-07,2021-04-01,"['31', '33', '47', '82']","L'objet du marché concerne la réalisation de prestations de service pour travaux de création, de conception, d'impression, de reprographie et de routage d'outils de communication à réal",fns,cmp2006,appeloffre,initial,SMEAG,31200,Toulouse,,"['Impression', 'Prestations de services', 'Publicité, Communication']","[160, 274, 285]",non,non
21-1088,2021-01-07,2021-04-04,['31'],Fourniture et acheminement en électricité,joue,directive24,attribution,initial,Mairie RIEUX VOLVESTRE,31310,Rieux-Volvestre,"[('2020-12-29', 'Total Direct Energie', (171645, 'EUR'), None)]","['Electricité, gaz (fourniture)']",[443],non,non
21-2586,2021-01-07,2021-04-06,['31'],20V0187PA - Travaux de rénovation des toitures terrasses de l'école maternelle Marengo Periole - SA/SG,fns,cmp2006,attribution,initial,COMMUNE DE TOULOUSE,31505,Toulouse,"[('2021-01-07', 'MCEB', (58833.86, 'EUR'), None)]",['Couverture'],[74],non,non
21-2227,2021-01-07,2021-04-06,['31'],20V0067PA- TRAVAUX DE RENOVATION DES CHAUFFERIES 2020 - DIVERS SITES DE LA VILLE DE TOULOUSE,fns,cmp2006,attribution,initial,COMMUNE DE TOULOUSE,31505,Toulouse,,['Chauffage (travaux)'],[61],non,non
21-843,2021-01-07,2021-02-05,['31'],20v0279aoo Je/Zd - Prestation d'écopâturage sur la base de loisirs des Argoulets Années 2021-2025,joue,directive24,appeloffre,initial,COMMUNE DE TOULOUSE,31505,Toulouse,,"['Animaux', 'Espaces verts']","[9, 116]",non,non
21-1401,2021-01-07,2021-04-04,['31'],20mc0353aoo - Fourniture De Carburants - Je/Hl,joue,directive24,attribution,initial,TOULOUSE METROPOLE,31505,Toulouse,"[('2021-01-04', 'Alvea', (33422, 'EUR'), None), ('2021-01-04', 'Hydrocarbures Midi-Pyrenees', (31058, 'EUR'), None)]","['Carburant, hydrocarbure']",[52],non,non
21-771,2021-01-07,2021-04-04,['31'],"20m0156aoo - Mission D'Ordonnancement, Pilotage Et Coordiantation (Opc) Création d'un techno-centre sur le site Atlanta à Toulouse - Sa/Sg",joue,directive24,attribution,initial,TOULOUSE METROPOLE,31505,Toulouse,"[('2020-12-28', 'Otce Organisation/Sept Pilotage Travaux Muret', (331135, 'EUR'), None)]","[""Mission d'ordonnancement, pilotage, coordination (OPC)""]",[234],non,non
21-1366,2021-01-07,2021-04-04,['31'],20mc0159pn -Je-Hz - Conception Et Mise En Oeuvre De Campagnes De Communication,joue,directive24,attribution,initial,TOULOUSE METROPOLE,31505,Toulouse,"[('2020-12-07', 'New Compact', (32590, 'EUR'), None), ('2020-12-07', 'Toulouse Agency Occitanie', (58525, 'EUR'), None), ('2020-12-07', 'Verywell', (35812.5, 'EUR'), None), ('2020-12-07', 'Inconito', (39830, 'EUR'), None)]","['Publicité, Communication']",[285],non,non
21-2307,2021-01-07,2021-04-06,['31'],20M0319PA - VOIE DE DESSERTE DU COLLEGE SAINT-SIMON - AMENAGEMENTS DES ESPACES PUBLICS MS-SG,fns,cmp2006,attribution,initial,TOULOUSE METROPOLE,31505,Toulouse,"[('2021-01-06', '&GUINTOLI/SIORAT/EHTP/LACIS', (387460.48, 'EUR'), None), ('2021-01-06', 'CLARAC & CIE', (51440.1, 'EUR'), None)]","['Assainissement', 'Espaces verts', 'Signalisation', 'Terrassement']","[18, 116, 322, 341]",non,non
21-2472,2021-01-07,2021-02-10,['31'],etude préalable au schéma directeur de gestion des eaux pluviales,mapa,cmp2006,appeloffre,initial,Communauté d'Agglomération du Sicoval,31670,Labège,,['Etude'],[118],non,non
21-924,2021-01-07,2021-04-04,['31'],Travaux de restructuration du groupe scolaire Aérogare à Blagnac - lot 13 Equipements de restauration; Cloisonnements isothermes,joue,directive24,attribution,initial,Ville de Blagnac,31700,Blagnac,"[('2020-12-10', 'Marin', (56901.68, 'EUR'), None)]","['Bâtiment', 'Cloison, faux plafond']","[33, 63]",non,non
21-789,2021-01-07,2021-02-08,"['31', '79', '69']",PRESTATIONS DE SERVICES ASSURANCES,joue,directive24,attribution,initial,Commune de Saint-Gaudens,31806,Saint-gaudens cedex,,"['Abris', 'Prestations de services']","[1, 274]",non,non
21-2525,2021-01-07,2021-02-28,"['33', '17', '16', '24', '47', '79', '64', '40', '87']","Travaux de maçonnerie, de carrelage et de VRD - batiments des services et établissements publics de l'Etat en région Nouvelle-Aquitaine",fns,cmp2006,appeloffre,initial,PREFECTURE AQUITAINE-SGAR-MRA,33000,Bordeaux,,['Maçonnerie'],[195],oui,oui
21-1348,2021-01-07,2021-02-06,"['33', '24', '17', '16']",Climatisation Institut des Métiers de l'Artisanat,joue,directive24,attribution,initial,CHBR REG METIERS ARTISANAT NOUV AQUIT,33000,Bordeaux,"[('2020-12-28', 'Chaud Climatisation Service', (237061.88, 'EUR'), 'Lot unique')]",['Climatisation'],[62],non,non
21-2520,2021-01-07,2021-03-04,['33'],Mandat de vente multicanale de billets de spectacle pour le compte de la Régie Personnalisée Opéra National de Bordeaux,fns,cmp2006,appeloffre,initial,ONB,33025,Bordeaux,,['Spectacle'],[472],non,non
21-2544,2021-01-07,2021-02-18,['33'],Réfections partielles des Couvertures & reprise des charpentes sur 6 écoles de Bordeaux Programmation 2021,fns,cmp2006,appeloffre,initial,COMMUNE DE BORDEAUX,33045,BORDEAUX,,['Couverture'],[74],non,non
21-1247,2021-01-07,2021-02-23,"['64', '40']","BDD PAU (64-40) - ACBC vérification et maintenance des portails, des portes,rideaux, des tourniquets et des barrières",joue,directive24,appeloffre,initial,MINDEF/SGA/DCSID/ESID Bordeaux,33068,Bordeaux cedex,,['Maintenance'],[196],non,non
20-155050,2021-01-07,2021-01-21,"['33', '64']",acquisition et livraison d'articles de menuiserie au profit d'entités spécialisées du ministère des armées,joue,directive24,attribution,initial,SCA/PFAF SO,33068,Bordeaux Cedex,"[('2020-12-21', 'Distribution matériaux bois panneaux', (160000, 'EUR'), 'acquisition et la livraison d\x92articles de menuiserie au profit d\x92entités spécialisées du Ministère des Armées')]",['Menuiserie'],[222],non,oui
21-1254,2021-01-07,2021-02-05,"['64', '40']","Maintenance préventive et curative postes ht bt, dépannage électrique d'urgence et travaux électriques - maintenance groupe électrogène onduleurs",joue,directive24,attribution,initial,MINDEF/SGA/DCSID/ESID Bordeaux,33068,Bordeaux cedex,,"['Bâtiment', 'Prestations de services']","[33, 274]",non,non
21-1086,2021-01-07,2021-04-04,['33'],Prestations de services d'assurances - Dommages aux biens et risques annexes pour les bâtiments et les collèges départementaux,joue,directive24,attribution,initial,DEPARTEMENT DE LA GIRONDE,33074,Bordeaux,"[('2020-12-09', 'Cgs Ct Chauray', (394799.17, 'EUR'), 'Bâtiments départementaux : dommages aux biens et risques annexes'), ('2020-12-09', 'Smacl', (483380.77, 'EUR'), 'Collèges départementaux : dommages aux biens et risques annexes')]",['Assurance'],[20],non,non
20-156801,2021-01-07,2021-02-09,['33'],renouvellement de la flotte automobile en location longue durée de la chambre de commerce et d'industrie bordeaux gironde,joue,directive24,appeloffre,initial,CCI Bordeaux,33076,Bordeaux cedex,,['Véhicules (location)'],[474],non,non
21-2135,2021-01-07,2021-04-06,['33'],Prestations de maintenance et fourniture de pièces détachées des débilitres pour le SDIS 33,fns,cmp2006,attribution,initial,SDIS 33 Gironde,33081,Bordeaux cedex,,['Prestations de services'],[274],non,non
21-454,2021-01-07,2021-02-11,['33'],Entretien des espaces verts et terre-pleins de la circonscription du gpmb (rectificatif),joue,autre,rectificatif,rectificatif,Grand Port Maritime de Bordeaux,33082,Bordeaux cedex,,['Espaces verts'],[116],oui,oui
21-2454,2021-01-07,2021-01-19,['33'],"Marché de collecte, transport et traitement des déchets créosotes, boues de peintures et peintures industriels, des déchets espaces verts et ceux du marché du samedi matin sur le territoire de Pessac",fns,cmp2006,appeloffre,rectificatif,Bordeaux Métropole,33600,PESSAC,,"['Prestations de services', 'Transport']","[274, 347]",non,non
21-1314,2021-01-07,2021-02-28,['33'],Evolution des outils du système d'informations de l'Agence de Développement et d'innovation de la Nouvelle-Aquitaine,joue,directive24,appeloffre,initial,AGENCE DEVELOPPEMENT INNOVATION N-A,33600,PESSAC,,"['Logiciel', 'Prestations de services']","[186, 274]",non,non
21-2750,2021-01-07,2021-01-29,['33'],Numéro de la consultation : 2021BE01 Contrôle technique des opérations de bâtiments,fns,cmp2006,appeloffre,initial,SYND MIXTE INTERCOMMUNAL COLLECTE VALO,33910,Saint Denis de Pile,,"['Contrôle technique', 'Déchetterie (travaux)']","[72, 96]",non,non
21-2672,2021-01-07,2021-04-06,['34'],Entretien et maintenance de stations de traitement des eaux usées et postes de refoulement sur des sites du Conseil Départemental de l'Hérault - Relance,fns,cmp2006,attribution,initial,Conseil départemental de l'Hérault,34087,MONTPELLIER,"[('2021-01-07', 'VE-CGE', (97200, 'EUR'), None)]",['Assainissement'],[18],non,non
21-951,2021-01-07,2021-04-04,['34'],prestations acoustiques et environnementales sur les routes départementales de l'hérault,joue,directive24,attribution,initial,Conseil départemental de l'Hérault,34087,Montpellier,"[('2021-01-04', 'Cereg Ingenierie', (400000, 'EUR'), None)]",['Ingénierie'],[455],non,non
21-1090,2021-01-07,2021-04-04,['34'],Travaux pour la création des jardins de Méditerranée au domaine départemental de Bayssan - Terrassements pleine masse - Confortements de sol,joue,directive24,attribution,initial,Conseil départemental de l'Hérault,34087,Montpellier,"[('2021-01-05', 'Buesa', (1697635.4, 'EUR'), None)]",['Terrassement'],[341],non,non
21-1091,2021-01-07,2021-04-04,['34'],Mission de coordination Sps cat Ii et Iii sur chantiers routiers,joue,directive24,attribution,initial,Conseil départemental de l'Hérault,34087,Montpellier,"[('2020-12-28', 'Lesueur Meunier Coordination', (134400, 'EUR'), 'Direction territoriale Piemont-Biterrois'), ('2020-12-28', 'Lesueur Meunier Coordination', (86120, 'EUR'), ""Direction territoriale Coeur d'Hérault - Cités Maritimes""), ('2020-12-24', 'Bureau Alpes Controles', (86120, 'EUR'), 'Direction territoriale Hautes Garrigues Camargue')]",['Ingénierie'],[455],non,non
21-1383,2021-01-07,2021-06-30,['34'],Fourniture de gaz industriels et de leurs emballages pour l'Université de Montpellier,joue,directive24,appeloffre,initial,UNIVERSITE DE MONTPELLIER,34090,Montpellier,,"['Gaz divers', 'Produits chimiques']","[139, 275]",non,non
21-969,2021-01-07,2021-01-24,"['34', '30', '66', '11']",Maintenance préventive et corrective des systèmes de sécurité incendie des bâtiments relevant du CROUS de Montpellier-Occitanie,joue,directive24,attribution,initial,CENTRE REGIONAL OEUVRES UNIV SCOLAIRES,34093,Montpellier,"[('2020-10-05', 'INEO', (21993.62, 'EUR'), 'Maintenance préventive et corrective des systèmes de sécurité incendie des bâtiments relevant du CROUS de Montpellier - LOT 1 - MONTPELLIER'), ('2020-10-22', 'HERVE THERMIQUE', (1916.25, 'EUR'), 'Maintenance préventive et corrective des systèmes de sécurité incendie des bâtiments relevant du Crous de Montpellier - LOT 2 - NIMES'), ('2020-10-05', 'INEO', (1239.26, 'EUR'), 'Maintenance préventive et corrective des systèmes de sécurité incendie des bâtiments relevant du Crous de Montpellier - LOT 3 - PERPIGNAN')]",['Sécurité incendie'],[332],non,non
21-831,2021-01-07,2021-01-21,"['34', '30', '66', '11']",Programme d'actions du Crous de Montpellier-Occitanie à destination des étudiants dans le domaine de la prévention et de la santé,joue,directive24,attribution,initial,CENTRE REGIONAL OEUVRES UNIV SCOLAIRES,34093,Montpellier,,['Prestations de services'],[274],non,non
21-1022,2021-01-07,2021-01-28,"['34', '11', '30', '66']",Dispositifs d'accompagnement psychologiques des étudiants de l'académie de Montpellier,joue,directive24,attribution,initial,CENTRE REGIONAL OEUVRES UNIV SCOLAIRES,34093,Montpellier,,['Prestations de services'],[274],non,non
21-772,2021-01-07,2021-04-04,['34'],Marché Public D'Exploitation Et De Performance Globale Des Installations De Génie Climatique Et Connexes,joue,directive24,attribution,initial,COMMUNE DE FRONTIGNAN,34113,Frontignan,"[('2020-12-29', 'Dalkia', (2758448, 'EUR'), None)]","['Chauffage (exploitation, entretien)']",[59],non,non
21-859,2021-01-07,2021-02-08,['34'],"Prestation De Service En Vue D'Animer Le Centre Ville De Pezenas Au Travers D'Une Mise En Valeur Patrimoniale, Touristique Et Economique (Metiers D'Art)",joue,directive24,appeloffre,initial,Ville de Pézenas,34120,Pézenas,,['Prestations de services'],[274],non,non
21-765,2021-01-07,2021-03-12,['34'],"fourniture, livraison et installation matériels professionnels de restauration pour distribution des repas en mode self-service",joue,directive24,attribution,initial,Ville de Montpellier,34267,Montpellier Cedex 2,"[('2020-12-21', 'SARL SALAGER SERRA', (960000, 'EUR'), 'Fourniture, livraison et installation matériels professionnels de restauration pour distribution des repas en mode self-service')]",['Equipements spécialisés'],[115],non,non
21-1118,2021-01-07,2021-03-31,['34'],reservation de berceaux aupres d'entreprises de creches sur le territoire communal,joue,directive24,attribution,initial,Ville de Montpellier,34267,Montpellier,"[('2020-12-28', 'LES PETITS CHAPERONS ROUGES-COLLECTIVITES PUBLIQUES', (172700, 'EUR'), 'QUARTIER MOSSON'), ('2020-12-28', 'LES PETITS CHAPERONS ROUGES-COLLECTIVITES PUBLIQUES', (287333, 'EUR'), 'QUARTIER HOPITAUX-FACULTES'), ('2021-01-04', 'BABILOU-EVANCIA', (415800, 'EUR'), 'QUARTIER CENTRE')]",['Prestations de services'],[274],non,non
21-1396,2021-01-07,2021-02-08,['34'],Organisation de spectacles pyrotechniques,joue,directive24,appeloffre,initial,COMMUNE D AGDE,34306,Agde,,"[""Feu d'artifice""]",[447],non,non
21-2690,2021-01-07,2021-02-07,['34'],Marché d'insertion professionnelle,fns,cmp2006,appeloffre,rectificatif,Communauté de Communes Pays de Lunel,34400,Lunel,,['Formation'],[410],non,non
20-150008,2021-01-07,2021-02-17,['34'],fourniture et maintenance de véhicules neufs en location longue durée,joue,directive24,appeloffre,initial,Ville de Juvignac,34990,Juvignac,,['Véhicules (location)'],[474],non,oui
21-2489,2021-01-07,2021-02-05,['14'],Maison d'Arrêt de Caen : Mise en place d'une colonne sèche et mise en conformité réglementaire avec l'alimentation des RIA,fns,cmp2006,attribution,initial,DIR INTERREGIONALE SCES PENITENTIAIRES,35031,Rennes,,['Plomberie (travaux)'],[270],non,non
21-2602,2021-01-07,2021-02-05,['76'],Travaux de remise à neuf de l'automate de pilotage des serrures électriques à la Maison d'Arrêt de ROUEN,fns,cmp2006,attribution,initial,DIR INTERREGIONALE SCES PENITENTIAIRES,35031,Rennes,,['Matériel électrique'],[203],non,non
21-2338,2021-01-07,2021-02-12,['29'],Maison d'Arrêt de Brest : Remplacement ascenseur sud - Lot serrurerie métallerie,fns,cmp2006,attribution,initial,DIR INTERREGIONALE SCES PENITENTIAIRES,35031,Rennes,,['Serrurerie'],[321],non,non
21-2763,2021-01-07,2021-02-01,['35'],PRODUCTION DE CLIPS ET FILMS PROMOTIONNELS POUR LE DEPARTEMENT D'ILLE-ET-VILAINE,fns,cmp2006,appeloffre,initial,Département d'Ille et Vilaine,35042,RENNES,,['Film'],[127],non,non
21-451,2021-01-07,2021-12-31,"['35', '22', '56']",prestation de service en assurance pour le groupement de commandes commune et ccas + résidence autonomie de montfort-sur-meu,joue,directive24,attribution,initial,Gpmt commandes Commune CCAS MONTFORT,35162,MONTFORT SUR MEU CEDEX,,"['Assurance', 'Prestations de services']","[20, 274]",non,non
21-1260,2021-01-07,2021-02-05,['35'],fourniture de sacs plastique pour la collecte selective des dechets menagers,joue,directive24,attribution,initial,VALCOBREIZH,35190,TINTENIAC,"[('2020-11-19', 'SOCOPLAST - 84 RUE MEDERIC-92250 LA GARENNE COLOMBES', (301020, 'EUR'), 'FOURNITURE DE SACS EN PLASTIQUE POUR LA COLLECTE SELECTIVE')]",['Sacs'],[318],non,oui
21-2539,2021-01-07,2021-03-04,['35'],Travaux pour la mise en place d'un bâtiment modulaire au Centre de Rétention Administrative à St Jacques de la Lande (35) - 2ème consultation,fns,cmp2006,attribution,initial,SEC GAL POUR L ADM MIN INTERIEUR OUEST,35207,Rennes cedex 2,"[('2021-01-05', 'Barthélémy', (40722.5, 'EUR'), None), ('2021-01-04', 'Atelier création métal', (42220.29, 'EUR'), None), ('2021-01-04', 'Bouygues énergie et services', (5997.36, 'EUR'), None)]","['Clôture', 'Electricité (travaux)', 'Gros oeuvre', 'Voirie et réseaux divers']","[64, 105, 144, 366]",non,non
21-1274,2021-01-07,2021-02-15,['35'],MISSIONS DE CONTROLE TECHNIQUE ET MISSIONS DE COORDINATION SECURITE PROTECTION DE LA SANTE DANS LE CADRE DES TRAVAUX DE CONSTRUCTION ET DE MODERNISATION DU CHU DE RENNES (PHASE 1 et 2),joue,directive24,appeloffre,initial,CTRE HOSPITALIER UNIVERS PONTCHAILLOU,35700,Rennes,,"['Contrôle technique', 'Prestations de services']","[72, 274]",non,non
20-157960,2021-01-07,2021-03-06,"['35', '14', '22', '29', '44', '49', '53', '56', '72']","groupement de commandes pour la fourniture de fourgons pompe-tonne pour les sdis 14, 22, 29, 35, 44, 49, 53, 56 et 72",joue,directive24,modification,modification,SCE DEPARTEMENTAL INCENDIE ET SECOURS,35701,Rennes Cedex 7,"[('2020-10-12', 'Société Sides', (18165000, 'EUR'), 'Fourniture de Fourgons Pompe-Tonne')]",['Véhicules (acquisition)'],[475],non,non
21-2166,2021-01-07,2021-02-19,"['22', '29', '35', '56']",Port de Saint-Malo - Réparation du quai Route du Rhum,fns,cmp2006,appeloffre,initial,Région Bretagne,35711,Rennes cedex 7,,"[""Ouvrage d'infrastructure""]",[253],non,non
21-1362,2021-01-07,2021-02-02,"['29', '22', '35', '56']",Port de Roscoff Vieux Port - Marché de maîtrise d'oeuvre relatif à la réhabilitation de l'estacade de desserte de l'île de Batz,joue,directive25,appeloffre,initial,Région Bretagne,35711,Rennes cedex,,['Prestations de services'],[274],non,non
21-941,2021-01-07,2021-03-08,"['27', '76', '80']",Base de défense d'Evreux - Maintenance préventive et corrective des groupes électrogènes,joue,directive24,appeloffre,initial,ESID de Rennes,35998,Rennes cedex 9,,['Maintenance'],[196],non,non
21-835,2021-01-07,2021-01-29,['36'],rd34 - pr 41+821 à pr 44+858 - reconstruction de la chaussée - communes de migny et saint-georges-sur-arnon,fns,cmp2006,appeloffre,initial,Conseil Départemental de l'Indre,36020,Châteauroux cédex,,['Voirie'],[365],non,non
21-2379,2021-01-07,2021-04-06,['37'],Travaux de reconstruction de la demi-pension et de locaux d'enseignement au Collège André BAUCHANT à Château-Renault,fns,cmp2006,attribution,initial,Conseil Général d'Indre et Loire,37927,Tours,"[('2020-11-27', 'isolba 41', (130709.47, 'EUR'), None)]",['Ravalement'],[299],non,non
21-2372,2021-01-07,2021-04-06,['37'],RESTRUCTURATION DE LA DEMI-PENSION ET DE LOCAUX D'ENSEIGNEMENT AU COLLEGE ANDRE BAUCHANT A CHATEAU RENAULT,fns,cmp2006,attribution,initial,Conseil Général d'Indre et Loire,37927,Tours,,"['Couverture', ""Tous corps d'état""]","[74, 345]",oui,non
21-2153,2021-01-07,2021-01-26,['38'],Assistance à maîtrise d'ouvrage pour la réalisation d'un audit financier et d'une prospective financière pluriannuelle du SMMAG,mapa,cmp2006,appeloffre,initial,SMMAG Mobilités de l'Aire Grenobloise,38031,GRENOBLE,,['Audit'],[21],non,non
21-2648,2021-01-07,2021-02-05,['38'],"Contrôle des rejets atmosphériques des chaudières, tours de désodorisation et torchères du site AQUAPOLE",mapa,cmp2006,appeloffre,initial,GRENOBLE-ALPES METROPOLE,38031,GRENOBLE,,['Assainissement'],[18],non,non
21-912,2021-01-07,2021-04-04,['38'],"Lavage, entretien et maintenance du parc de colonnes enterrées et semi-enterrées sur le territoire métropolitain",joue,directive24,attribution,initial,GRENOBLE-ALPES METROPOLE,38031,Grenoble,"[('2020-12-18', 'Pollunet', (1000000, 'EUR'), None)]","['Conteneur, poubelles', 'Maintenance', 'Prestations de services']","[71, 196, 274]",non,non
21-983,2021-01-07,2021-02-28,['38'],AO21PROT - Fourniture de dispositifs médicaux stériles : dispositifs médicaux implantables et dispositifs médicaux spécialisés,joue,directive24,appeloffre,initial,CTRE HOSPITALIER UNVT GRENOBLE,38043,Grenoble cedex 09,,['Consommables médicaux'],[69],non,non
21-2165,2021-01-07,2021-02-08,['38'],"Fourniture de laits infantiles, de préparations et d'aliments lactés destinés à l'enfant",fns,cmp2006,appeloffre,initial,CTRE HOSPITALIER UNVT GRENOBLE,38043,Grenoble cedex 09,,['Boisson'],[39],non,non
21-655,2021-01-07,2021-01-31,['38'],Maintenance et fourniture de pièces détachées et consommables des équipements de laboratoire de marque SAKURA,joue,directive24,attribution,initial,CTRE HOSPITALIER UNVT GRENOBLE,38043,Grenoble,"[('2020-12-30', 'Sakura Finetek France', (50000, 'EUR'), 'Maintenance et fourniture de pièces détachées et consommables des équipements de laboratoire de marque SAKURA')]",['Prestations de services'],[274],non,non
21-673,2021-01-07,2021-01-31,['38'],Maintenance et contrôle des équipements de dialyse de marque Fresenius et fourniture d'accessoires et pièces détachées,joue,directive24,attribution,initial,CTRE HOSPITALIER UNVT GRENOBLE,38043,Grenoble,"[('2020-12-30', 'FRESENIUS MEDICAL CARE FRANCE SAS', (80000, 'EUR'), ""Maintenance et contrôle des équipements de dialyse de marque Fresenius et fourniture d'accessoires et pièces détachées"")]",['Prestations de services'],[274],non,non
21-118,2021-01-07,2021-03-08,['38'],tri et conditionnement des dechets recyclables secs,joue,directive24,attribution,initial,COM COMMUNES LYON ST EXUPERY DAUPHINE,38230,Charvieu-Chavagneux,"[('2020-12-10', 'PAPREC GRAND EST', (600000, 'EUR'), None)]",['Ordures ménagères (prestations)'],[249],non,non
21-916,2021-01-07,2021-02-03,['38'],Location et maintenance de 2 châssis équipés de bennes à ordures ménagères avec grue auxiliaire et une benne ouverte basculante,joue,directive24,appeloffre,initial,C. de C. du Massif du Vercors,38250,Villard de Lans,,"['Benne', 'Véhicules (location)']","[34, 474]",non,oui
21-1422,2021-01-07,2021-04-04,['38'],Exploitation du bas de quai sur les dechetteries Intercommunales de Beaurepaire et Montseveroux,joue,directive24,attribution,initial,ENTRE BIEVRE ET RHONE,38550,Saint Maurice L Exil,"[('2021-01-04', 'Valorsol Environnement', (167900, 'EUR'), 'Gros Objets'), ('2021-01-04', 'Valorsol Environnement', (30399.6, 'EUR'), 'Déchets Ménagers Spéciaux')]",['Déchetterie (exploitation)'],[405],non,non
