a00_cle_idweb,g04_01_date_publication,g04_03_date_fin_diffusion,g04_07_dep_publication,g04_09_resume_objet,g01_02_01_famille,g01_02_02_perimetre,g01_02_03_nature,g01_02_04_statut,d01_01_denomination,d01_07_cp,d01_08_ville,d08_09_decision_titulaireandRENSEIGNEMENT,g04_052_descripteurs_libelles,g04_051_descripteurs_codes,g04_061_criteres_sociaux,g04_062_criteres_environnementaux
21-766,2021-01-07,2021-04-04,['78'],"Fourniture, livraison de matériels numériques",joue,directive24,attribution,initial,Conseil départemental des Yvelines,78012,Versailles,,['Matériel électronique'],[204],non,non
21-1340,2021-01-07,2021-02-05,['78'],"Sartrouville - Marché public global de performance pour la conception, la réalisation et l'exploitation-maintenance d'une cité scolaire",joue,directive24,appeloffre,initial,Conseil départemental des Yvelines,78012,Versailles,,"['Matériaux de construction', 'Prestations de services']","[198, 274]",non,non
21-1347,2021-01-07,2021-01-13,['78'],"Travaux portant sur les bâtiments dont le Département des Yvelines a la propriété ou la jouissance et dont le montant total (tous lots cumulés) est inférieur ou égal à 2,5 millions",joue,autre,rectificatif,rectificatif,Conseil départemental des Yvelines,78012,Versailles,,"['Ascenseur', 'Bâtiments modulaires', 'Cuisine (équipement)']","[17, 27, 77]",non,non
21-2550,2021-01-07,2021-02-17,['78'],"CARRIERES-SUR-SEINE - Collège Les Amandiers - Travaux de restructuration demi-pension et 3 blocs sanitaires élèves, construction : 1 bloc sanitaire/atelier factotum et 1 préau - Missions de contrôle t",fns,cmp2006,appeloffre,initial,Conseil départemental des Yvelines,78012,VERSAILLES,,"['Contrôle technique', 'Prestations de services']","[72, 274]",non,non
21-849,2021-01-07,2021-04-04,['78'],Rd308 - Réhabilitation du Pont de Maisons-Lafitte,joue,directive24,attribution,initial,Conseil départemental des Yvelines,78012,Versailles,"[('2020-11-09', 'Nge Genie Civil', (5099512, 'EUR'), None)]","[""Ouvrage d'infrastructure""]",[253],oui,oui
21-678,2021-01-07,2021-02-05,['78'],"Affrètement d'un navire, battant pavillon français, de type roulier, opérant sur toutes les zones maritimes au profit du ministère des Armées (MINARM) ou sous couvert du MINARM.",joue,autre,rectificatif,rectificatif,Plate-Forme Affrètement et Transport,78140,Velizy villacoublay,,['Transport'],[347],non,non
21-870,2021-01-07,2021-04-04,['78'],Fourniture Et Livraison De Mobilier Scolaire Et De Petit Equipement Pour Les Services De La Ville (3 lots),joue,directive24,attribution,initial,Ville de Trappes,78197,Trappes,"[('2020-12-14', 'Diagonales', (400000, 'EUR'), 'Fourniture Mobilier pour classes et réfectoires'), ('2020-12-14', 'Nel mobilier', (120000, 'EUR'), 'Fourniture Mobilier ludique'), ('2020-12-14', 'Manutan Collectivites', (80000, 'EUR'), 'Fourniture équipement audio/vidéo petit électroménager')]","['Articles de bureau et articles scolaires', 'Electroménager', 'Vidéo, cinéma']","[16, 108, 362]",non,oui
21-777,2021-01-07,2021-04-04,['78'],Relance Suite A La Non Reconduction Du Lot 13 : Produits De Boulangerie Et Viennoiseries Du Marche De Denrees Alimentaires Pour La Ville De Trappes,joue,directive24,attribution,initial,Ville de Trappes,78197,Trappes,"[('2020-12-14', 'Argon', (120000, 'EUR'), None)]","['Restauration collective', 'Denrées alimentaires', ""Produits de l'agriculture""]","[66, 88, 276]",non,non
21-957,2021-01-07,2021-04-04,['78'],Acquisition de denrées alimentaires brutes pour la confection des repas à titre principal des établissements d'accueil du jeune enfant de la Ville de Viroflay,joue,directive24,attribution,initial,COMMUNE DE VIROFLAY,78220,Viroflay,"[('2020-12-29', 'Dupont Restauration', (200000, 'EUR'), 'Fourniture et livraison de repas cuisinés en liaison froide'), ('2021-01-04', 'Normapro France', (280000, 'EUR'), 'Acquisition de denrées alimentaires brutes pour la confection des repas')]","['Restauration collective', 'Denrées alimentaires', 'Repas, traiteur']","[66, 88, 304]",non,oui
21-1218,2021-01-07,2021-02-05,['78'],Entretien des espaces verts de la commune,joue,directive24,appeloffre,initial,COMMUNE DE CHAMBOURCY,78240,Chambourcy,,"['Arrosage', 'Espaces verts']","[13, 116]",oui,oui
21-914,2021-01-07,2021-01-29,"['78', '92']",Fourniture et Livraison de repas en liaison froide pour la restauration scolaire et personnel communal,joue,directive24,attribution,initial,ville de Bois d'Arcy,78390,Bois d\\\'Arcy,,"['Barquettes alimentaires', 'Restauration collective', 'Denrées alimentaires', 'Repas, traiteur']","[32, 66, 88, 304]",non,non
21-1028,2021-01-07,2021-01-30,['78'],"Location de 5 avions, homologués, avec équipage, disposant de capacités minimales d'emport variant entre 9 et 22 places, au profit de la FORFUSCO - 5 lots.",joue,directive24,attribution,initial,Plate-Forme Affrètement et Transport,78457,Vélizy cédex,"[('2020-12-10', 'SPACE DROPPING', (252000, 'EUR'), ""Location d'un avion homologué avec équipage, disposant d'une capacité d'emport minimale de 9 parachutistes pour la réalisation d'opérations de largage en SOCR sur le département du Morbihan.""), ('2020-12-10', 'CHUTEXTREM', (218160, 'EUR'), ""Location d'un avion, homologué, avec équipage, disposant d'une capacité d'emport minimale de 16 parachutistes pour la réalisation d'opérations de largage en SOCR sur le département du Morbihan.""), ('2020-12-10', 'CAE AVIATION', (921500, 'EUR'), ""Location d'un avion, homologué, avec équipage, disposant d'une capacité d'emport minimale de 22 parachutistes pour la réalisation d'opérations de largage en SOA et SOCR dans les depts 56, 03 et 83.""), ('2020-12-10', 'SPACE DROPPING', (45000, 'EUR'), ""Location d'un avion homologué avec équipage, disposant d'une capacité d'emport minimale de 9 parachutistes pour la réalisation d'opérations de largage en SOCR sur le département du Var.""), ('2020-12-10', 'CHUTEXTREM', (90000, 'EUR'), ""Location d'un avion, homologué, avec équipage, disposant d'une capacité d'emport minimale de 16 parachutistes pour la réalisation d'opérations de largage en SOCR sur le département du Var."")]",['Location (matériels)'],[185],non,non
21-1255,2021-01-07,2021-02-05,['78'],"Acquisition, livraison, montage et installation de mobilier",joue,directive24,appeloffre,initial,COMMUNE DE SAINT REMY LES CHEVREUSE,78470,Saint-remy-les-chevreuse,,['Mobilier'],[230],non,non
21-2695,2021-01-07,2021-02-15,"['78', '95']",Le présent marché a pour objet la réfection complète de la toiture en tuiles de la maternelle Jean Jaurès,fns,cmp2006,appeloffre,initial,ville de Sartrouville,78506,Sartrouville,,"['Bâtiment', 'Couverture', 'Isolation']","[33, 74, 169]",non,non
21-1299,2021-01-07,2021-04-04,['78'],"Réparations, Maintenances Et Vérifications Périodiques Règlementaires",joue,directive24,attribution,initial,ville de Sartrouville,78506,Sartrouville,"[('2020-12-24', 'Apave parisienne Sas', (1, 'EUR'), 'Vérifications périodiques des installations électriques'), ('2020-12-24', 'Socotec Diagnostic', (1, 'EUR'), 'Réalisation de repérages amiantes'), ('2020-12-23', 'Dalcom', (1, 'EUR'), 'Maintenances, entretien et réparation des installations de désenfumage'), ('2020-12-23', ""A2a l'Alternative Ascenseur"", (1, 'EUR'), ""Maintenance des ascenseurs, élévateurs, monte-charges et manche d'évacuation"")]","['Contrôle technique', 'Maintenance', 'Amiante (diagnostic)']","[72, 196, 431]",non,non
21-1126,2021-01-07,2021-02-03,"['78', '91', '75', '28']",Travaux de réhabilitation-extension de la piscine communautaire des Fontaines à Rambouillet (lot 6-3),joue,autre,rectificatif,rectificatif,Rambouillet Territoires,78511,Rambouillet cedex,,['Nettoyage de locaux'],[239],non,non
21-1421,2021-01-07,2021-04-04,['79'],"Maintenance des équipements frigorifiques, des équipements de restauration et d'autres équipements pour l'Ucpa et les services de soins",joue,directive24,attribution,initial,CENTRE HOSPITALIER DE NIORT,79021,Niort,"[('2020-12-28', 'Erco', (37056, 'EUR'), ""Maintenance des équipements frigorifiques, des équipements de restauration et d'autres équipements pour l'Ucpa et les services de soins - Centre Hospitalier de Niort et Ghms""), ('2020-12-22', 'Dalkia', (509814.04, 'EUR'), ""Maintenance des équipements frigorifiques, des équipements de restauration et d'autres équipements pour l'Ucpa et les services de soins - Chnds et Ch Mauléon"")]","['Cuisine (équipement)', 'Maintenance']","[77, 196]",non,non
21-2566,2021-01-07,2021-02-02,['79'],Phase administrative de la révision des périmètres de protection des captages de Ligaine,mapa,cmp2006,appeloffre,initial,Syndicat du Val de Loire,79300,Bressuire,,['Etude'],[118],non,non
20-152233,2021-01-07,2021-01-29,['80'],convention d'occupation du domaine public pour l'exploitation d'un golf périurbain de 9 trous situé sur la commune de salouel,divers,autre,appeloffre,initial,AMIENS METROPOLE,80027,Amiens cedex 1,,"['Equipement sportif', 'Prestations de services']","[113, 274]",non,non
21-1239,2021-01-07,2021-02-09,['80'],Fourniture d'alimentation et de bazar pour les services des collectivités membres de la centrale d'achats Amiens Métropole (notamment pour les centres de loisirs).,joue,directive24,appeloffre,initial,Amiens Métropole,80027,AMIENS,,"['Denrées alimentaires', 'Quincaillerie (articles)']","[88, 291]",non,non
21-1148,2021-01-07,2021-02-10,['80'],contrat de concession pour l'exploitation du service public de l'assainissement collectif,dsp,dsp,appeloffre,initial,Commune de Cambron,80132,Cambron,,"['Assainissement', 'Délégation de service public']","[18, 406]",non,non
21-1089,2021-01-07,2021-04-04,['81'],Achat De Fournitures Pour L'Entretien Du Parc Automobile,joue,directive24,attribution,initial,COMMUNE DE CASTRES,81115,Castres,"[('2020-12-21', 'York', (120000, 'EUR'), 'Fourniture De Lubrifiants'), ('2020-12-21', 'Taquipneu', (480000, 'EUR'), 'Fourniture Et Prestations Pneumatiques Tous Vehicules, Engins Et Materiel'), ('2020-12-29', 'Sas Autodistribution Fia', (12000, 'EUR'), ""Fourniture D'Equipements Et Accessoires Electriques, De Consommables Automobiles""), ('2020-12-28', 'Barriac Vi 81', (36000, 'EUR'), 'Fourniture De Signalisation, Eclairage Et Accessoires'), ('2020-12-21', 'Castres-Diesel', (20000, 'EUR'), 'Fourniture De Liquide De Refroidissement Et De Lave Glace'), ('2020-12-28', 'Barriac Vi 81', (18000, 'EUR'), ""Fourniture D'Adblue""), ('2020-12-29', 'Sas Autodistribution Fia', (36000, 'EUR'), 'Fourniture De Batteries'), ('2020-12-29', 'Sas Autodistribution Fia', (72000, 'EUR'), 'Fourniture De Pieces De Rechanges Adaptables Vehicules Legers Et Vehicules Utilitaires'), ('2020-12-21', 'Ctdi', (76000, 'EUR'), 'Fourniture De Composants Hydrauliques Et Flexibles'), ('2020-12-21', 'Ctdi', (62000, 'EUR'), 'Fourniture De Filtres'), ('2020-12-28', 'Eurovoirie', (20000, 'EUR'), 'Founrniture De Pieces De Rechanges Pour Le Materiel Eurovoirie')]",['Véhicules (acquisition)'],[475],non,non
21-709,2021-01-07,2021-02-05,['81'],SERVICES D'ASSURANCE DES PRESTATIONS STATUTAIRES DE LA COMMUNAUTÉ DE COMMUNES TARN-AGOUT,joue,directive24,attribution,initial,COMMUNAUTE DE COMMUNES TARN AGOUT,81370,St sulpice,"[('2020-12-29', 'SOFAXIS', (115783, 'EUR'), ""Services d'assurance des prestations statutaires de la Communauté de Communes TARN-AGOUT"")]","['Assurance', 'Prestations de services']","[20, 274]",non,non
21-2541,2021-01-07,2021-02-01,['82'],MISSION DE MAITRISE D'OEUVRE POUR L'AMENAGEMENT D'UN GITE 'ETAPE' POUR LE VELO A PORT CANAL,fns,cmp2006,appeloffre,initial,Grand Montauban Communauté d'agglo,82000,MONTAUBAN CEDEX,,"[""Maîtrise d'oeuvre""]",[197],non,non
21-1336,2021-01-07,2021-02-04,['82'],Fourniture et livraison de carburants et combustibles,joue,directive24,appeloffre,initial,Grand Sud Tarn-et-Garonne,82370,Labastide Saint Pierre,,"['Carburant, hydrocarbure']",[52],non,oui
21-1195,2021-01-07,2021-04-04,['83'],"Marché d'assurances :dommages aux biens,responsabilité civile et flotte automobile",joue,directive24,attribution,initial,OPH - Var Habitat,83040,Toulon,"[('2020-10-30', 'Diot Immobilier Courtage', (349956, 'EUR'), 'Dommages aux biens'), ('2020-10-30', 'Assurances_pilliot', (17508, 'EUR'), 'Responsabilité civile'), ('2020-10-30', 'Smacl', (23004, 'EUR'), 'Parc automobile')]",['Assurance'],[20],non,non
21-1200,2021-01-07,2021-04-04,['83'],Fourniture de carburant en stations services par cartes accréditives,joue,directive24,attribution,initial,OPH - Var Habitat,83040,Toulon,"[('2020-10-30', 'Total Marketing France', (65616, 'EUR'), None)]","['Carburant, hydrocarbure']",[52],non,non
21-1285,2021-01-07,2021-02-15,['83'],"20pi19 Prestations de maîtrise d'oeuvre d'aménagement d'espace public, d'études paysagères et routières de la Corniche Tamaris qui s'étend sur 4,5 kms",joue,directive24,appeloffre,initial,Métropole Toulon Provence Méditerranée,83041,Toulon,,['Etude'],[118],non,non
21-759,2021-01-07,2021-02-10,['83'],"20serv29-Prestations d'opérateurs fonciers pour les besoins de la Métropole Toulon Provence Méditerranée, en 2 lots",joue,directive24,appeloffre,initial,Métropole Toulon Provence Méditerranée,83041,Toulon,,['Assistance juridique'],[434],non,non
21-1337,2021-01-07,2021-02-08,['83'],20map45 Prestations d'insertion pour la collecte et le nettoiement sur le territoire métropolitain de la Seyne-sur-Mer,joue,directive24,appeloffre,initial,Métropole Toulon Provence Méditerranée,83041,Toulon,,['Collecte sélective'],[82],oui,non
21-1338,2021-01-07,2021-02-05,['83'],"Marché à procédure adaptée en vue des prestations de gardiennage, surveillance et de sûreté à l'occasion de l'exposition de la Collection Lévy au sein du Musée d'Art de Toulon",joue,directive24,appeloffre,initial,COMMUNE DE TOULON,83056,Toulon,,['Gardiennage'],[138],non,non
21-1339,2021-01-07,2021-02-18,['83'],"Aoo Prestations de restauration collective pour les établissements scolaires et les Acm de la Ville de Toulon assorties de prestations d'assistance spécialisée, de conseil et de fo",joue,directive24,appeloffre,initial,COMMUNE DE TOULON,83056,Toulon,,['Restauration collective'],[66],non,oui
21-1406,2021-01-07,2021-04-04,['83'],Prestation de service d'impression d'affiches,joue,directive24,attribution,initial,Conseil Général du Var,83076,Toulon,"[('2020-11-18', 'Mc2p', (8359.6, 'EUR'), None)]",['Imprimés'],[161],non,non
21-2516,2021-01-07,2021-01-25,['83'],Maîtrise d'oeuvre pour la renaturation de la plage de Saint-Pons (rectificatif),fns,cmp2006,appeloffre,rectificatif,Ville de Grimaud,83316,GRIMAUD,,"[""Maîtrise d'oeuvre""]",[197],non,non
21-685,2021-01-07,2021-02-03,['83'],"Fournitures de denrées alimentaires issues de l'agriculture conventionnelle, biologique et en circuits courts, direct producteurs-AOO1_ALIM2020-AVIS D'ATTRIBUTION",joue,directive24,attribution,initial,SI VAROIS D AIDE AUX ACHATS DIVERS,83430,Saint-Mandrier,,['Denrées alimentaires'],[88],non,non
21-1047,2021-01-07,2021-02-05,['83'],ASSURANCE RESPONSABILITÉ CIVILE,joue,directive24,attribution,initial,Ville de Fréjus,83600,Fréjus,,['Assurance'],[20],non,non
21-2702,2021-01-07,2021-02-04,['83'],Fourniture et pose d'une conduite d'adduction d'eau potable en DN 400 mm et DN 300 mm pour l'alimentation des réservoirs de Planestel et de Superplasnestel 83600 LES ADRETS DE L&ap,fns,cmp2006,appeloffre,initial,Syndicat de l'eau du Var Est - S.E.V.E,83601,Fréjus,,"['Automatisation', 'Canalisations']","[14, 48]",non,non
21-2728,2021-01-07,2021-02-06,['83'],AMÉLIORATION ET EXTENSION DE L'ARROSAGE AUTOMATIQUE DE LA COMMUNE DE FRÉJUS,fns,cmp2006,attribution,initial,Ville de Fréjus,83608,Fréjus Cedex,[],['Arrosage'],[13],non,non
21-814,2021-01-07,2021-03-05,['83'],Base navale de Toulon - Remplacement du bateau-porte no1 - Mission d'assistance à maitrise d'ouvrage (AMO) technique,joue,directive24,attribution,initial,MINDEF/SGA/DCSID/ESID.TOULON,83800,Toulon cedex 9,,"[""Assistance à maîtrise d'ouvrage""]",[433],non,oui
21-757,2021-01-07,2021-02-04,['83'],"Produits d'hygiène, d'entretien et articles de droguerie pour les besoins de la ville de la garde (en 4 lots)",joue,directive24,appeloffre,initial,Ville de La Garde,83957,La Garde,,['Hygiène (articles)'],[153],non,non
21-716,2021-01-07,2021-01-16,['84'],"MARCHÉ PUBLIC D'EXPLOITATION DES INSTALLATIONS DE GENIE CLIMATIQUE ET CONNEXES POUR LES CH d'ORANGE, VALREAS ET EHPAD DE BOLLENE ET PIOLENC (84).",joue,directive24,attribution,initial,Centre Hospitalier Louis Giorgi,84104,Orange cedex,,['Maintenance'],[196],non,non
21-2213,2021-01-07,2021-02-06,['84'],2020/21 Fourniture de connexions internet,fns,cmp2006,appeloffre,rectificatif,Ville de Pertuis,84120,Pertuis,,['Informatique (prestations de services)'],[163],non,non
21-945,2021-01-07,2021-02-04,['84'],FOURNITURE ET ACHEMINEMENT DE GAZ NATUREL ET SERVICES COMPLEMENTAIRES,joue,directive24,attribution,initial,COMMUNE DE PERNES LES FONTAINES,84210,Pernes les Fontaines,"[('2020-12-18', 'TOTAL DIRECT ENERGIE SA', (287022, 'EUR'), ""fourniture et d'acheminement de gaz naturel ainsi que les services associés et complémentaires."")]","['Electricité, gaz (fourniture)']",[443],non,non
20-158994,2021-01-07,2021-03-06,['85'],Distribution de sacs pour la collecte des déchets recyclables,joue,directive24,attribution,initial,LA ROCHE-SUR-YON AGGLOMERATION,85000,La Roche-sur-Yon,"[('2020-12-28', ""TRAIT D'UNION"", (1600000, 'EUR'), 'Distribution de sacs pour la collecte des déchets recyclables')]","['Collecte sélective', 'Prestations de services', 'Sacs']","[82, 274, 318]",non,non
20-158973,2021-01-07,2021-03-06,['85'],fourniture de sacs pour la collecte des déchets recyclabes,joue,directive24,attribution,initial,VILLE DE LA ROCHE SUR YON,85000,La Roche-sur-Yon,"[('2020-12-29', 'PTL SAS', (1600000, 'EUR'), 'Fourniture de sacs pour la collecte des déchets recyclables')]","['Sacs', 'Déchets non ménagers (prestations)']","[318, 404]",non,oui
21-2199,2021-01-07,2021-02-04,['85'],Secteur de la Vallée du Jaunay - Saint Gilles Croix de Vie - Travaux de démolition de l'ancienne station de surpression du Pavillon et de modification des réseaux associés.,fns,cmp2006,appeloffre,initial,VENDEE EAU,85036,La Roche sur Yon,,"['Alimentation en eau potable', 'Démolition']","[6, 87]",non,non
21-739,2021-01-07,2021-02-03,['85'],Gestion des Aires d'Accueil des Gens du Voyage,joue,autre,rectificatif,rectificatif,Communauté de Communes Vie et Boulogne,85170,Le Poiré sur Vie,,"[""Aire d'accueil""]",[430],non,non
21-2471,2021-01-07,2021-02-06,['85'],"Fauchage, débroussaillage, élagage des voies sur la commune d'Aubigny-Les Clouzeaux",mapa,cmp2006,appeloffre,initial,Aubigny Les Clouzeaux,85430,AUBIGNY LES CLOUZEAUX,,['Espaces verts'],[116],non,non
21-911,2021-01-07,2021-01-14,['85'],Missions d'Assistance à Maitrise d'Ouvrage (Amo) pour la réalisation de travaux sur l'ensemble du patrimoine immobilier du Conseil Départemental de la Vendée,joue,autre,rectificatif,rectificatif,Département de la Vendée,85923,La Roche Sur Yon,,"['Assistance technique', 'Prestations de services', 'Ingénierie']","[19, 274, 455]",non,non
21-992,2021-01-07,2021-02-19,['86'],Renouvellement des réseaux d'eau potable 2021 -1ère phase,joue,directive24,appeloffre,initial,Eaux de Vienne - Siveer,86000,Poitiers,,"['Alimentation en eau potable', 'Réseaux divers']","[6, 306]",non,non
21-975,2021-01-07,2021-02-05,"['86', '75', '69', '34', '91', '92', '93', '95', '94']",20-011 Acquisition de matériel audiovisuel,joue,directive24,attribution,initial,Réseau Canopé,86961,Futuroscope,,['Audiovisuel'],[22],non,non
21-2682,2021-01-07,2021-02-01,['87'],"Station de mesure automatisée de résistivité de dépôts, films minces et ultra-minces en fonction de la température Université de Limoges IRCER",mapa,cmp2006,appeloffre,initial,Université de Limoges,87032,Limoges,,['Equipements spécialisés'],[115],non,non
21-2585,2021-01-07,2021-02-08,['88'],"fourniture de vêtements professionnels, linges plats, chaussures, oreiller et autres fournitures diverses pour le ght vosges",fns,cmp2006,appeloffre,initial,CH INTERCOMMUNAL EMILE DURKHEIM,88000,Epinal,,['Chaussures ou articles chaussants'],[79],non,non
20-157512,2021-01-07,2021-03-05,['88'],fourniture de fondants routiers - centrale d'achat cae,joue,directive24,attribution,initial,CA D EPINAL,88190,Golbey,"[('2020-12-17', 'ROCK', (174000, 'EUR'), 'Fourniture et livraison de sel de déneigement en vrac'), ('2020-12-17', 'ROCK', (244000, 'EUR'), 'Fourniture et livraison de sel de déneigement conditionné en big-bag de 500 kg'), ('2020-12-17', 'ROCK', (28160, 'EUR'), 'Fourniture et livraison de sel de déneigement en sacs de 25 kg')]",['Sel de déneigement'],[320],non,non
21-730,2021-01-07,2021-02-05,['88'],marché de maîtrise d'oeuvre pour la construction d'une maison de santé pluridisciplinaire et d'une pharmacie.,joue,directive24,attribution,initial,COMMUNE ELOYES,88510,ELOYES,,"[""Maîtrise d'oeuvre""]",[197],non,non
21-2658,2021-01-07,2021-02-20,"['89', '77', '10', '45']",Mission de maîtrise d'oeuvre relative à la réhabilitation de réseaux des eaux usées,mapa,cmp2006,appeloffre,initial,COMMUNE DE PERCENEIGE,89260,Perceneige,,['Assainissement'],[18],non,non
21-2635,2021-01-07,2021-01-22,['89'],Réhabilitation et Rénovation thermique du Centre Communal d'Action SocialeLa commune de Migennes souhaite engager la réhabilitation du CCAS dans l'optique d'optimiser la performance é,fns,cmp2006,appeloffre,initial,COMMUNE DE MIGENNES,89400,Migennes,,['Isolation'],[169],non,non
21-232,2021-01-07,2021-01-29,['90'],tour des 4 as - 6ème étage - aménagement de la direction de l'insertion,fns,cmp2006,appeloffre,rectificatif,DEPARTEMENT DU TERRITOIRE DE BELFORT,90000,Belfort,,"['Bâtiment', 'Carrelage', 'Chauffage (travaux)', 'Climatisation', 'Cloison, faux plafond', 'Electricité (travaux)', 'Menuiserie', 'Mobilier', 'Peinture (travaux)', 'Plâtrerie', 'Plomberie (travaux)', 'Revêtements de sols', 'Sanitaire', ""Tous corps d'état"", 'Ventilation', 'Vitrerie', 'Occultation']","[33, 53, 61, 62, 63, 105, 222, 230, 264, 269, 270, 308, 319, 345, 360, 363, 414]",non,non
21-2402,2021-01-07,2021-01-15,['90'],Vérifications périodiques et maintenance réglementaire des installations d'éclairage de sécurité avec source centrale des bâtiments de la Ville de Belfort,mapa,cmp2006,appeloffre,initial,Ville de Belfort,90020,BELFORT,,['Maintenance'],[196],non,non
21-2395,2021-01-07,2021-01-27,['90'],Nettoyage des espaces de tri,fns,cmp2006,appeloffre,initial,Cté de l'Agglomération Belfortaine,90020,BELFORT CEDEX,,"['Conteneur, poubelles', 'Nettoyage urbain']","[71, 240]",non,non
21-2743,2021-01-07,2021-02-05,['91'],"EQUIPEMENT DU SERVICE EVENEMENTIEL EN MATERIEL DE SONORISATION, D'ECLAIRAGE ET AUTRES ACCESSOIRES CONNEXES DE LA VILLE DE CORBEIL-ESSONNES",fns,cmp2006,appeloffre,initial,ville de Corbeil-Essonnes,91100,Corbeil essonnes,,['Matériel scénique'],[216],non,non
21-944,2021-01-07,2021-02-12,['91'],MAINTENANCE DES INSTALLATIONS DE SÉCURITÉ INCENDIE DU CENTRE HOSPITALIER SUD FRANCILIEN ET DU CENTRE HOSPITALIER D'ARPAJON,joue,directive24,appeloffre,initial,Centre Hospitalier Sud Francilien,91106,Corbeil essonnes,,['Maintenance'],[196],non,non
21-1328,2021-01-07,2021-06-25,"['91', '77', '75', '92', '94', '95']",Construction de 42 logements collectifs en locatif social et coques commerciales à rez-de-chaussée - EVRY,joue,directive24,appeloffre,initial,ESSONNE HABITAT,91130,Ris-Orangis,,['Bâtiment'],[33],non,non
21-1160,2021-01-07,2021-01-20,['91'],Assurances,joue,directive24,attribution,initial,CENTRALESUPELEC,91190,Gif-sur-yvette,,['Assurance'],[20],non,non
21-756,2021-01-07,2021-02-15,['91'],Modélisation du patrimoine existant du cnrs pour la délégation régionale ile de france gif sur yvette,fns,cmp2006,attribution,initial,CNRS,91198,Gif sur Yvette,,['Ingénierie'],[455],non,non
21-865,2021-01-07,2021-04-04,['91'],Prestations de nettoyage des bâtiments communaux,joue,directive24,attribution,initial,COMMUNE DE SAINT MICHEL SUR ORGE,91240,Saint-Michel-sur-Orge,"[('2020-12-15', 'Isor', (2400000, 'EUR'), None)]",['Nettoyage de locaux'],[239],non,non
21-861,2021-01-07,2021-04-04,['91'],Prestations de nettoyage des espaces publics communaux,joue,directive24,attribution,initial,COMMUNE DE SAINT MICHEL SUR ORGE,91240,Saint-Michel-sur-Orge,"[('2020-12-04', 'Europe Services Voirie', (1451320, 'EUR'), None)]",['Nettoyage urbain'],[240],non,oui
21-857,2021-01-07,2021-04-04,['91'],Achat et livraison de fournitures scolaires et activités manuelles,joue,directive24,attribution,initial,COMMUNE DE SAINT MICHEL SUR ORGE,91240,Saint-Michel-sur-Orge,"[('2020-12-24', 'cipa', (400000, 'EUR'), None)]",['Articles de bureau et articles scolaires'],[16],non,non
21-2305,2021-01-07,2021-02-04,['91'],Reconstruction d'un bâtiment modulaire vestiaires et club-house au complexe sportif de La Cheminée Blanche à Vert-le-Petit,fns,cmp2006,appeloffre,initial,Mairie de Vert le Petit,91710,VERT LE PETIT,,"['Bâtiments modulaires', 'Démolition', 'Gros oeuvre', 'Voirie et réseaux divers', 'Amiante (désamiantage)']","[27, 87, 144, 366, 479]",non,non
21-1054,2021-01-07,2021-01-31,['91'],"Contrat de délégation de service public sous forme d'affermage pour l'exploitation du Centre aquatique intercommunal "" La Vague "" à Palaiseau",joue,directive23,attribution,initial,CA COMMUNAUTE PARIS SACLAY,91898,Orsay cedex,"[('2020-12-18', 'EQUALIA SARL', (1999220, 'EUR'), 'Contrat de délégation de service public sous forme d\'affermage pour l\'exploitation du Centre aquatique intercommunal ""La Vague"" à Palaiseau')]",['Piscine'],[265],non,non
