,a00_cle_idweb,g04_01_date_publication,g04_03_date_fin_diffusion,g04_07_dep_publication,g04_09_resume_objet,g01_02_01_famille,g01_02_02_perimetre,g01_02_03_nature,g01_02_04_statut,d01_01_denomination,d01_07_cp,d01_08_ville,d08_09_decision_titulaireandRENSEIGNEMENT,g04_052_descripteurs_libelles,g04_051_descripteurs_codes,g04_061_criteres_sociaux,g04_062_criteres_environnementaux
0,21-45349,2021-04-05,2021-05-09,['49'],"MISSIONS DE MAÎTRISE D'OEUVRE BATIMENTS, ASSAINISSEMENT ET VRD - PHASE CANDIDATURE",joue,directive24,appeloffre,initial,ANJOU LOIR ET SARTHE,49125,Tiercé,,"['Assainissement', 'Bâtiment', ""Maîtrise d'oeuvre"", 'Voirie et réseaux divers']","[18, 33, 197, 366]",non,non
1,20-79791,2021-04-05,2021-12-31,['59'],travaux de requalification des espaces publics des cités hardy ballanger à fresnes-sur-escaut,joue,directive24,attribution,initial,Cté d'Agglo Valenciennes Métropole,59305,Valenciennes,,"['Alimentation en eau potable', 'Assainissement', 'Eclairage public', 'Espaces verts', 'Serrurerie', 'Signalisation', 'Terrassement', 'Voirie']","[6, 18, 102, 116, 321, 322, 341, 365]",oui,non
2,21-45330,2021-04-05,2021-05-06,['69'],Fourniture d'un accès fédéral au réseau internet pour la Ville de Lyon,joue,directive24,appeloffre,initial,Ville de Lyon,69205,Lyon cedex 01,,['Informatique (prestations de services)'],[163],non,non
3,21-45350,2021-04-05,2021-05-05,"['75', '57', '54', '77', '78', '91', '92', '93', '94']",Prestations de restauration et annexes au profit de l'institution nationale des invalides à Paris (75) et Woippy (57).,joue,directive24,appeloffre,initial,Institution Nationale des Invalides,75700,Paris 07 sp,,"['Abris', 'Restauration collective']","[1, 66]",oui,oui
4,21-45332,2021-04-05,2021-04-28,['93'],Concession de service public portant sur la gestion et l'exploitation du marché forain,joue,directive23,appeloffre,initial,COMMUNE DE BLANC MESNIL,93150,Le Blanc Mesnil,,['Délégation de service public'],[406],non,non
5,21-45329,2021-04-05,2021-04-16,['93'],COLLECTE DES DECHETS MENAGERS ET ASSIMILES ET PRESTATIONS ANNEXES SUR LE TERRITOIRE DE PLAINE COMMUNE,joue,autre,rectificatif,rectificatif,EPT Plaine Commune,93218,Saint-Denis cedex,,['Ordures ménagères (prestations)'],[249],oui,oui
6,21-45342,2021-04-05,2021-05-07,"['93', '75', '92']",MARCHE PUBLIC GLOBAL DE PERFORMANCE POUR LA RENOVATION ENERGETIQUE DU BATIMENT UNIVERSITAIRE C DU CAMPUS DE SAINT-DENIS,joue,directive24,appeloffre,initial,Université Paris 8,93526,Saint-Denis,,['Bâtiment'],[33],non,non
7,21-45353,2021-04-05,2021-05-04,['971'],Services d'entretien par curage et hydrocurage des réseaux d'eaux pluviales avec prestations associées sur le territoire de la Communauté d'Agglomération la Riviera du Levant(CARL)(noAO,joue,directive24,appeloffre,initial,COMMUNAUTE D AGL LA RIVIERA DU LEVANT,97190,LE GOSIER,,['Curage'],[78],non,oui
